@context,@type,@customType,identifier,copyrightHolder,license,tomasBookingId,category,name,disambiguatingDescription,description,titleTeaser,textTeaser,detailedInformation,zurichCardDescription,zurichCard,osm_id,image,price,photo,dateModified,opens,openingHours,openingHoursSpecification,specialOpeningHoursSpecification,address,geoCoordinates,place
https://schema.org/,CivicStructure,ArtObject,1828,"{'de': 'Zürich Tourismus www.zuerich.com', 'en': 'Zurich Tourism www.zuerich.com', 'it': 'Zürich Tourismo www.zuerich.com', 'fr': 'Zürich Tourisme www.zuerich.com'}",CC BY-SA,,"{'Attractions': {'swissId': ''}, 'Works of Art': {'swissId': ''}}","{'de': 'Das philosophische Ei – Mario Merz', 'en': 'The Philosopher’s Egg – Mario Merz', 'fr': ""L'œuf philosophique – Mario Merz"", 'it': ""L'uovo filosofico, Mario Merz""}","{'de': 'Das philosophische Ei von Mario Merz schmückt die Bahnhofshalle des Zürcher Hauptbahnhofs.', 'en': ""The Philosopher’s Egg by Mario Merz decorates the station concourse at Zurich's Main Railway Station."", 'fr': ""L'œuf philosophique de Mario Merz enjolive le hall de la gare centrale de Zurich."", 'it': ""L'uovo filosofico di Mario Merz adorna il padiglione della Stazione Centrale di Zurigo.""}","{'de': '<p>In luftiger H&ouml;he installierte der italienische K&uuml;nstler Mario Merz 1992 &laquo;Das philosophische Ei&raquo;. Rote Spiralformen aus Neonr&ouml;hren und plastisch geformte, freih&auml;ngende Tiere bilden einen wirkungsvollen, dynamischen Kontrapunkt zur klassizistischen N&uuml;chternheit der Z&uuml;rcher Bahnhofshalle.<p>Die Ziffern sind eine Hommage an den mittelalterlichen italienischen Mathematiker Leonardo Fibonacci, der mit seiner Zahlenreihe bewies, dass die Natur mathematische Gesetzm&auml;ssigkeiten befolgt.</p></p>', 'en': '<p>""The Philosopher&rsquo;s Egg"" by the Italian artist Mario Merz features red spiral shapes made from neon tubes, combined with free-hanging 3D animals. It has been suspended high above the hall of Zurich\'s Main Railway Station since 1992, forming an effective, dynamic counterpoint to the classic sobriety below.<p>The numerals pay homage to the medieval Italian mathematician Leonard Fibonacci &ndash; who used his sequence of numbers to prove that nature adheres to mathematical principles.</p></p>', 'fr': ""<p>Install&eacute; en 1992 par l'artiste italien Mario Merz dans la gare centrale de Zurich, l&rsquo;&oelig;uf&nbsp;philosophique surplombe le hall: les tubes de n&eacute;on forment des spirales rouges et les animaux en 3D suspendus dans le vide contrastent de mani&egrave;re dynamique avec la sobri&eacute;t&eacute; de l&rsquo;architecture classique du hall de la gare de Zurich.<p>Les chiffres constituent un hommage &agrave; Leonardo Fibonacci, un math&eacute;maticien italien du Moyen Age, qui a d&eacute;montr&eacute;, au moyen de suites de nombres, que la nature ob&eacute;it &agrave; des r&egrave;gles math&eacute;matiques.</p></p>"", 'it': ""<p>Nel 1992, l'artista italiano Mario Merz install&ograve; &ldquo;L&rsquo;uovo filosofico&rdquo;: spirali rosse realizzate con tubi al neon e animali sospesi in efficace, dinamico contrasto con la sobriet&agrave; neoclassica della Stazione Centrale.<p>I numeri sono un omaggio al matematico medievale italiano Leonardo Fibonacci, che, con la sua sequenza di cifre, dimostr&ograve; che in natura esistono regole matematiche.</p></p>""}","{'de': 'Philosophisches Ei', 'en': 'The Philosopher’s Egg', 'fr': ""L'œuf philosophique"", 'it': 'Uovo filosofico'}","{'de': 'Das philosophische Ei von Mario Merz schmückt die Bahnhofshalle des Zürcher Hauptbahnhofs.', 'en': ""The Philosopher’s Egg by Mario Merz decorates the station concourse at Zurich's Main Railway Station."", 'fr': ""L'œuf philosophique de Mario Merz enjolive le hall de la gare centrale de Zurich."", 'it': ""L'uovo filosofico di Mario Merz adorna il padiglione della Stazione Centrale di Zurigo.""}","{'de': ['Kunst im öffentlichen Raum', 'Kunst mit mathematischem Hintergrund', 'In der Haupthalle des Hauptbahnhof Zürich'], 'en': ['Art in public spaces', 'Art with a mathematical background', 'In the main concourse of Zurich Main Station'], 'fr': ['L’art dans l’espace public', 'L’art dans un contexte mathématique ', 'Dans le hall principal de la gare centrale de Zurich'], 'it': ['Arte negli spazi pubblici', 'Arte di ispirazione matematica', 'Nel padiglione principale della Stazione Centrale di Zurigo']}",,False,1236383343,"{'url': 'https://www.zuerich.com/sites/default/files/keyvisual/web_zurich_art_philosophersegg_mario-merz_01.jpg', 'caption': {'de': None, 'en': '', 'fr': None, 'it': None}}","{'de': None, 'en': None, 'fr': None, 'it': None}",,2024-10-14T15:56,"['Monday', 'Tuesday', 'Wednesday', 'Thursday', 'Friday', 'Saturday', 'Sunday']",,,"{'de': '<p>&Ouml;ffentlich zug&auml;nglich</p>', 'en': '<p>Open to the public</p>', 'fr': '<p>Ouvert au public</p>', 'it': '<p>Aperto al pubblico</p>'}","{'addressCountry': 'CH', 'addressLocality': 'Zürich', 'postalCode': '8001', 'streetAddress': '', 'telephone': None, 'email': None, 'url': 'https://www.sbb.ch/en/station-services/at-the-station/railway-stations/shopville-zuerich-main-station/artwork/the-philosophers-egg-mario-merz.html'}","{'latitude': 47.377764, 'longitude': 8.540615}",['Indoors']
https://schema.org/,Museum,,1806,"{'de': 'Zürich Tourismus www.zuerich.com', 'en': 'Zurich Tourism www.zuerich.com', 'it': 'Zürich Tourismo www.zuerich.com', 'fr': 'Zürich Tourisme www.zuerich.com'}",CC BY-SA,,"{'Culture': {'swissId': 'sui_02'}, 'Museums': {'swissId': ''}, 'Cultural History': {'swissId': 'sui_0209'}, 'Attractions': {'swissId': ''}, 'Monuments': {'swissId': ''}}","{'de': 'Ritterhaus Bubikon – Ein Ausflug zu den alten Rittern', 'en': 'Ritterhaus Bubikon – Visiting the Knights of the Past', 'fr': 'Ritterhaus Bubikon – une excursion à la découverte des anciens chevaliers', 'it': 'Ritterhaus Bubikon: una gita ai tempi dei cavalieri'}","{'de': 'Das Ritterhaus in Bubikon gilt als die besterhaltene Niederlassung des Johanniterordens in Europa. Seine Ursprünge reichen zurück ins 12. Jahrhundert.', 'en': 'The Ritterhaus in Bubikon is regarded as the best-preserved Commandery of the Order of St. John in Europe. Its roots date back to the 12th century.', 'fr': ""La Commanderie de l'Ordre de Saint-Jean à Bubikon est la mieux conservée d'Europe. Ses origines remontent au XIIe siècle."", 'it': ""Il Ritterhaus di Bubikon è considerato la sede dell'Ordine di San Giovanni meglio tenuta d'Europa. Le origini affondano nel XII secolo.""}","{'de': '<p>Jahrhundertelang diente das Ritterhaus dem Johanniterorden als Domizil. Von hier aus verwaltete der Ritterorden seine ansehnlichen umliegenden Besitzt&uuml;mer.<br><br> Die Anlage ist ein einzigartiges mittelalterliches Denkmal. Die Rittergesellschaft Bubikon rettete es vor dem Verfall und betreibt heute das Museum.<br><br> Die Ausstellung erz&auml;hlt die Geschichte des Ordens und zeichnet die &uuml;ber Jahrhunderte stattfindenden Umbauarbeiten im Ritterhaus nach. Neben einer M&uuml;nzsammlung begeistert auch eine umfangreiche Waffenausstellung die Besucher. Im Kr&auml;utergarten findet man Gew&uuml;rze und Heilkr&auml;uter, die auch schon im Mittelalter angepflanzt wurden.</p>', 'en': '<p>The Ritterhaus was used as a residence by the Order of St. John for many centuries. From here, the order of knights managed its considerable assets in the surrounding area.<br><br> The site is a unique mediaeval monument. Thanks to the Ritterhaus Bubikon society it was saved from certain downfall and today operates as a museum.<br><br> The exhibition tells the story of the order and illustrates the redevelopment work, which has taken place at the Ritterhaus over the centuries. Visitors can see a coin collection and comprehensive weapons display. The herb garden is home to various healing herbs and spices planted here in the Middle Ages.</p>', 'fr': ""<p>Durant des si&egrave;cles, les chevaliers de l'Ordre de Saint-Jean ont habit&eacute; dans la Commanderie de Bubikon d'o&ugrave; ils administraient leurs vastes propri&eacute;t&eacute;s attenantes.<br> &nbsp;<br> L'&eacute;tablissement est un t&eacute;moin remarquable du Moyen &Acirc;ge. La Soci&eacute;t&eacute; de la Maison des chevaliers de Bubikon le sauva de la ruine et g&egrave;re actuellement le mus&eacute;e. Celui-ci raconte l'histoire de l'ordre et pr&eacute;sente les diff&eacute;rents am&eacute;nagements du b&acirc;timent s'&eacute;talant sur plusieurs si&egrave;cles. Les visiteurs pourront admirer une collection numismatique et de nombreuses armes. Le jardin potager permet de d&eacute;couvrir des &eacute;pices et des plantes m&eacute;dicinales d&eacute;j&agrave; cultiv&eacute;es au Moyen &Acirc;ge.</p>"", 'it': ""<p>Per secoli, il Ritterhaus funse da domicilio all'Ordine di San Giovanni. Da qua, l'ordine dei cavalieri amministrava le considerevoli propriet&agrave; circostanti.<br><br> La struttura &egrave; un monumento medievale straordinario. La societ&agrave; dei cavalieri di Bubikon la salv&ograve; dal declino e oggi gestisce il museo.<br><br> La mostra racconta la storia dell'ordine e riproduce i lavori di ristrutturazione del Ritterhaus avvenuti nel corso dei secoli. Oltre a una collezione di monete, qui si trova anche una vasta esposizione di armi. Nel giardino delle erbe aromatiche si incontrano spezie e piante medicinali che venivano piantate gi&agrave; nel Medioevo.</p>""}","{'de': 'Ritterhaus Bubikon', 'en': 'Ritterhaus Bubikon', 'fr': 'Ritterhaus Bubikon', 'it': 'Ritterhaus Bubikon'}","{'de': 'Das Ritterhaus in Bubikon gilt als die besterhaltene Niederlassung des Johanniterordens in Europa.', 'en': 'The Ritterhaus is regarded as the best-preserved Commandery of the Order of St. John in Europe.', 'fr': ""La Ritterhaus Bubikon est la commanderie de l'Ordre de Saint-Jean la mieux conservée d'Europe."", 'it': ""Il Ritterhaus di Bubikon è considerato la sede dell'Ordine di San Giovanni meglio tenuta d'Europa.""}","{'de': ['Museum', 'Gebäude teilweise aus dem 12. Jh.', 'Ehemals Domizil des Johanniterordens', 'Geschichte des Ordens'], 'en': ['Museum', 'Some buildings dating from the 12th century', 'Former domicile of the Order of St. John', 'History of the Order'], 'fr': ['Musée', 'Bâtiment datant en partie du XIIe siècle', 'Ancien domicile de l’ordre de Saint-Jean', 'Histoire de l’ordre'], 'it': ['Museo', 'Edificio in parte risalente al XII secolo', 'Ex domicilio dell’Ordine di San Giovanni', 'Storia dell’Ordine']}",,False,5589329682,"{'url': 'https://www.zuerich.com/sites/default/files/keyvisual/web_zurich_culture_ritterhaus-bubikon_01.jpg', 'caption': {'de': 'Luftaufnahme des Ritterhauses Bubikon, eine guterhaltene Niederlassung des Johanniterordens', 'en': 'Aerial view on the Ritterhaus Bubikon, a well-preserved Commandery of the Order of St. John', 'fr': ""Photo aérienne de la Ritterhaus Bubikon, une commanderie de l'Ordre de Saint-Jean bien conservée"", 'it': ""Aerofotografia del Ritterhaus Bubikon, una sede ben conservata dell'Ordine di San Giovanni""}}","{'de': '<div class=""table-container"">\r\n<table class=""is-fullwidth table"">\r\n\t<thead>\r\n\t\t<tr>\r\n\t\t\t<th>Eintritt</th>\r\n\t\t\t<th>&nbsp;</th>\r\n\t\t</tr>\r\n\t</thead>\r\n\t<tbody>\r\n\t\t<tr>\r\n\t\t\t<th>Regulär</th>\r\n\t\t\t<td>CHF 10</td>\r\n\t\t</tr>\r\n\t\t<tr>\r\n\t\t\t<th>Ermässigt</th>\r\n\t\t\t<td>CHF&nbsp; 6</td>\r\n\t\t</tr>\r\n\t</tbody>\r\n</table>\r\n</div>\r\n', 'en': '<div class=""table-container"">\r\n<table class=""is-fullwidth table"">\r\n\t<thead>\r\n\t\t<tr>\r\n\t\t\t<th>Entrance</th>\r\n\t\t\t<th>&nbsp;</th>\r\n\t\t</tr>\r\n\t</thead>\r\n\t<tbody>\r\n\t\t<tr>\r\n\t\t\t<th>Regular</th>\r\n\t\t\t<td>CHF 10</td>\r\n\t\t</tr>\r\n\t\t<tr>\r\n\t\t\t<th>Concessions</th>\r\n\t\t\t<td>CHF&nbsp; 6</td>\r\n\t\t</tr>\r\n\t</tbody>\r\n</table>\r\n</div>\r\n', 'fr': '<div class=""table-container"">\r\n<table class=""is-fullwidth table"">\r\n\t<thead>\r\n\t\t<tr>\r\n\t\t\t<th>Entrée</th>\r\n\t\t\t<th>&nbsp;</th>\r\n\t\t</tr>\r\n\t</thead>\r\n\t<tbody>\r\n\t\t<tr>\r\n\t\t\t<th>Normal</th>\r\n\t\t\t<td>CHF 10</td>\r\n\t\t</tr>\r\n\t\t<tr>\r\n\t\t\t<th>Réduit</th>\r\n\t\t\t<td>CHF&nbsp; 6</td>\r\n\t\t</tr>\r\n\t</tbody>\r\n</table>\r\n</div>\r\n', 'it': '<div class=""table-container"">\r\n<table class=""is-fullwidth table"">\r\n\t<thead>\r\n\t\t<tr>\r\n\t\t\t<th>Ingresso</th>\r\n\t\t\t<th>&nbsp;</th>\r\n\t\t</tr>\r\n\t</thead>\r\n\t<tbody>\r\n\t\t<tr>\r\n\t\t\t<th>Regolare</th>\r\n\t\t\t<td>CHF 10</td>\r\n\t\t</tr>\r\n\t\t<tr>\r\n\t\t\t<th>Ridotto</th>\r\n\t\t\t<td>CHF&nbsp; 6</td>\r\n\t\t</tr>\r\n\t</tbody>\r\n</table>\r\n</div>\r\n'}","[{'url': 'https://www.zuerich.com/sites/default/files/imagegallery/web_zurich_sehenswuerdigkeiten_ritterhaus-bubikon_01.jpg', 'caption': {'de': None, 'en': '', 'fr': None, 'it': None}}, {'url': 'https://www.zuerich.com/sites/default/files/imagegallery/web_zurich_sehenswuerdigkeiten_ritterhaus-bubikon_03.jpg', 'caption': {'de': None, 'en': '', 'fr': None, 'it': None}}, {'url': 'https://www.zuerich.com/sites/default/files/imagegallery/web_zurich_sehenswuerdigkeiten_ritterhaus-bubikon_04.jpg', 'caption': {'de': None, 'en': '', 'fr': None, 'it': None}}, {'url': 'https://www.zuerich.com/sites/default/files/imagegallery/web_zurich_sehenswuerdigkeiten_ritterhaus-bubikon_02.jpg', 'caption': {'de': None, 'en': '', 'fr': None, 'it': None}}, {'url': 'https://www.zuerich.com/sites/default/files/imagegallery/web_zurich_sehenswuerdigkeiten_ritterhaus-bubikon_05.jpg', 'caption': {'de': None, 'en': '', 'fr': None, 'it': None}}]",2024-11-20T16:54,"['Tuesday', 'Wednesday', 'Thursday', 'Friday', 'Saturday', 'Sunday']","['Su,Sa 10:00:00-17:00:00', 'Tu,We,Th,Fr 13:00:00-17:00:00']",,"{'de': None, 'en': None, 'fr': None, 'it': None}","{'addressCountry': 'CH', 'addressLocality': 'Bubikon', 'postalCode': '8608', 'streetAddress': 'Ritterhausstrasse 35', 'telephone': '055 243 39 90', 'email': 'info@ritterhaus.ch', 'url': 'https://www.ritterhaus.ch'}","{'latitude': 47.266551, 'longitude': 8.827725}",['Indoors']
https://schema.org/,Church,,1794,"{'de': 'Zürich Tourismus www.zuerich.com', 'en': 'Zurich Tourism www.zuerich.com', 'it': 'Zürich Tourismo www.zuerich.com', 'fr': 'Zürich Tourisme www.zuerich.com'}",CC BY-SA,,"{'Attractions': {'swissId': ''}, 'Churches': {'swissId': ''}}","{'de': 'Wasserkirche', 'en': 'Wasserkirche', 'fr': 'Wasserkirche – Lieu de martyre des saints patrons de Zurich', 'it': 'Wasserkirche: dove i patroni della città divennero martiri'}","{'de': 'Wo heute die Wasserkirche steht, wurden einst die Stadtheiligen Zürichs – Felix und Regula – hingerichtet. So erzählt es die Legende.', 'en': 'Legend has it that the site of the Wasserkirche church is where Zurich’s patron saints, Felix and Regula, were executed.', 'fr': 'La légende raconte que là où aujourd’hui se trouve l’église Wasserkirche, ont été exécutés les saints patrons de Zurich, Felix et Regula.\r\n', 'it': 'Dove oggi si trova la Wasserkirche, un tempo furono giustiziati i santi patroni di Zurigo Felix e Regula. Così narra la leggenda.\r\n\r\n'}","{'de': '<p>Die Wasserkirche stand urspr&uuml;nglich auf einer kleinen Insel, auf der &ndash; glaubt man der Legende &ndash; die Stadtheiligen Felix und Regula von den R&ouml;mern hingerichtet wurden.<p>Die sp&auml;tgotische Kirche wurde gegen Ende des 15. Jahrhunderts vollendet und galt als besonders heilig. In der Reformationszeit wurde sie deswegen als &laquo;G&ouml;tzentempel&raquo; apostrophiert. Damit niemand in Versuchung geriet, den Heiligenkult wieder einzuf&uuml;hren, wurden ein Warenlager und sp&auml;ter die B&uuml;rgerbibliothek in der Kirche eingerichtet.</p><p>Seit 1942 dient sie nach einer Renovierung gottesdienstlichen und kulturellen Zwecken. Besonders sch&ouml;n sind die im selben Jahr entstandenen Chorfenster von Augusto Giacometti, die das Leben Christi dem Leben eines modernen Mannes gegen&uuml;berstellen.</p></p>', 'en': '<p>The ""Water Church"" was originally built on a small island where, according to legend, the city\'s martyrs Felix and Regula were executed by the Romans.<p>This late Gothic church was completed towards the end of the 15th century and was regarded as being particularly holy. This is why, during the Reformation, it was referred to as a ""temple of idol worshippers"". A warehouse and then a municipal library were set up to prevent anyone being tempted to re-introduce the cult of the saints.&nbsp;</p><p>Renovated in 1942, the church is now used for religious and cultural purposes. A particularly attractive highlight are the choir windows by Augusto Giacometti, which contrast the life of Jesus Christ with the life of modern man.</p></p>', 'fr': ""<p>L'&eacute;glise Wasserkirche (l'&eacute;glise de l'eau) se trouvait &agrave; l&rsquo;origine sur une petite &icirc;le o&ugrave;, selon la l&eacute;gende, les saints patrons de la ville, Felix et Regula, auraient &eacute;t&eacute; ex&eacute;cut&eacute;s par les Romains.<p>De style gothique flamboyant, l&rsquo;&eacute;glise a &eacute;t&eacute; achev&eacute;e &agrave; la fin du XVe si&egrave;cle, et &eacute;tait consid&eacute;r&eacute;e comme particuli&egrave;rement sacr&eacute;e. Pour cette raison, elle sera qualifi&eacute;e de &laquo; temple de l'idol&acirc;trie &raquo; pendant la R&eacute;forme. Afin que personne ne soit tent&eacute; d&rsquo;y r&eacute;introduire le culte des saints, un entrep&ocirc;t y sera install&eacute; et, plus tard, la biblioth&egrave;que municipale.</p><p>R&eacute;nov&eacute;e en 1942, l&rsquo;&eacute;glise est utilis&eacute;e depuis &agrave; des fins religieuses et culturelles. Un vrai bijou sont les vitraux du ch&oelig;ur, cr&eacute;&eacute;s par Augusto Giacometti. Ils illustrent la vie du Christ en contraste avec celle de l&rsquo;homme moderne.&nbsp;</p></p>"", 'it': '<p>La Wasserkirche sorgeva in origine su una piccola isola. Secondo la leggenda, qui vennero giustiziati dai romani i santi patroni della citt&agrave;, Felix e Regula. La chiesa tardo-gotica venne completata verso la fine del XV secolo ed era considerata particolarmente sacra.<p>Nel periodo della Riforma, venne tacciata per questo di essere un &ldquo;tempio dell&rsquo;idolatria&rdquo;. Affinch&eacute; a nessuno venisse la tentazione di reintrodurre il culto dei santi, al suo interno venne istituito un magazzino merci e, pi&ugrave; tardi, la biblioteca municipale.</p><p>Nel 1942, la chiesa fu rinnovata e da allora viene utilizzata per celebrare la messa e a scopo culturale. Particolarmente belle sono le vetrate del coro di Augusto Giacometti, realizzate nello stesso anno, che mettono a confronto la vita di Cristo con quella di un uomo moderno.</p></p>'}","{'de': 'Wasserkirche', 'en': 'Wasserkirche', 'fr': 'Wasserkirche', 'it': 'Wasserkirche'}","{'de': 'Wo heute die Wasserkirche steht, wurden die Stadtheiligen Zürichs – Felix und Regula – hingerichtet.', 'en': 'The site of the Wasserkirche church is where Zurich’s patron saints were executed.', 'fr': 'Là où aujourd’hui se trouve l’église Wasserkirche, ont été exécutés les saints patrons de Zurich.', 'it': 'Dove oggi si trova la Wasserkirche, furono giustiziati i santi patroni di Zurigo Felix e Regula.'}","{'de': ['Kult- und Kulturort', 'Direkt an der Limmat gelegen', 'Diverse Veranstaltungen'], 'en': ['Cult and cultural place', 'Located directly on the River Limmat', 'Various events'], 'fr': ['Lieu culturel et culte', 'Juste au bord de la Limmat', 'Divers évènements '], 'it': ['Cult e cultura', 'In riva alla Limmat', 'Vari eventi']}",,False,112795856,"{'url': 'https://www.zuerich.com/sites/default/files/keyvisual/web_zurich_sightseeing_wasserkirche_03.jpg', 'caption': {'de': 'Wasserkirche Zürich', 'en': 'Wasserkirche Zurich', 'fr': 'Wasserkirche Zurich', 'it': None}}","{'de': None, 'en': None, 'fr': None, 'it': None}","[{'url': 'https://www.zuerich.com/sites/default/files/web_zuerich_wasserkirche_1280x960_7621.jpg', 'caption': {'de': 'Wasserkirche Zürich', 'en': '', 'fr': None, 'it': None}}, {'url': 'https://www.zuerich.com/sites/default/files/web_zuerich_wasserkirche_1280x960_10597.jpg', 'caption': {'de': 'Wasserkirche Zürich', 'en': '', 'fr': None, 'it': None}}, {'url': 'https://www.zuerich.com/sites/default/files/tt_reformation_zuerich_wasserkirche_10227.jpg', 'caption': {'de': 'Wasserkirche Zürich', 'en': 'Wasserkirche', 'fr': 'Wasserkirche', 'it': 'Wasserkirche'}}, {'url': 'https://www.zuerich.com/sites/default/files/web_zuerich_wasserkirche_1280x960_10228.jpg', 'caption': {'de': 'Wasserkirche Zürich', 'en': 'Wasserkirche Zürich', 'fr': 'Wasserkirche Zürich', 'it': 'Wasserkirche Zürich'}}]",2024-10-14T15:56,"['Tuesday', 'Wednesday', 'Thursday', 'Friday', 'Saturday', 'Sunday']","['Su,Tu,We,Th,Fr,Sa 14:00:00-17:00:00']",,"{'de': '<p>W&auml;hrend Gottesdiensten und anderen Anl&auml;ssen sind keine Besichtigungen m&ouml;glich.</p>', 'en': '<p>During church services and other occasions no visits are possible.</p>', 'fr': '<p>Pendant les services religieux et autres occasions pas de visites sont possibles.</p>', 'it': '<p>Durante le funzioni religiose e altre occasioni le visite non sono possibili.</p>'}","{'addressCountry': 'CH', 'addressLocality': 'Zürich', 'postalCode': '8001', 'streetAddress': 'Limmatquai 31', 'telephone': '+41 44 250 66 00', 'email': None, 'url': 'https://wasserkirche.ch/'}","{'latitude': 47.369856, 'longitude': 8.543162}","['Indoors', 'Outdoors']"
