@context,@type,@customType,identifier,copyrightHolder,license,tomasBookingId,category,name,disambiguatingDescription,description,titleTeaser,textTeaser,detailedInformation,zurichCardDescription,zurichCard,osm_id,image,price,photo,dateModified,opens,openingHours,openingHoursSpecification,specialOpeningHoursSpecification,address,geoCoordinates,place
https://schema.org/,LocalBusiness,,1011454,"{'de': 'Zürich Tourismus www.zuerich.com', 'en': 'Zurich Tourism www.zuerich.com', 'it': 'Zürich Tourismo www.zuerich.com', 'fr': 'Zürich Tourisme www.zuerich.com'}",CC BY-SA,,"{'Place': {'swissId': ''}, 'Attractions': {'swissId': ''}, 'Vantage Points': {'swissId': ''}, 'Nature': {'swissId': ''}, 'Mountains': {'swissId': ''}}","{'de': 'Jungfraujoch mit der Zürich Card', 'en': 'Jungfraujoch with the Zürich Card', 'fr': 'Jungfraujoch avec la Zürich Card', 'it': 'Jungfraujoch con la Zürich Card'}","{'de': 'Mit der Zürich Card erhalten Gäste 15% auf das einmalige Bergabenteuer Jungfraujoch – Top of Europe.', 'en': 'With the Zürich Card, guests benefit from 15% discount on the amazing mountain adventure to the Jungfraujoch – Top of Europe.', 'fr': 'Avec la Zürich Card, les visiteurs et visiteuses bénéficient de 15% sur l’aventure unique en montagne « Jungfraujoch – Top of Europe ».', 'it': 'Con la Zürich Card, gli ospiti ricevono il 15% di sconto sull’incredibile avventura montana in vetta allo Jungfraujoch – Top of Europe.'}","{'de': '<p>Wer clever plant, spart beim Tagesausflug auf das einzigartige Jungfraujoch 15%! Alles, was dazu n&ouml;tig ist, ist eine g&uuml;ltige <a href=""https://www.zuerich.com/de/zuerichcard"">Z&uuml;rich Card</a>.&nbsp;&nbsp;<p><strong>Und so wird&rsquo;s gemacht: &nbsp;</strong></p><p>Ab Z&uuml;rich Hauptbahnhof ist bis nach Interlaken Ost oder Grindelwald Terminal ein Bahnticket zum Normaltarif zu l&ouml;sen. Das geht an allen Ticketautomaten der SBB, an einem SBB-Schalter, in der SBB-App oder in der Tourist Information im Hauptbahnhof Z&uuml;rich.&nbsp;&nbsp;</p><p>F&uuml;r die Weiterreise ab Interlaken Ost beziehungsweise Grindelwald Terminal bis hoch hinauf zum Jungfraujoch k&ouml;nnen die 15% Erm&auml;ssigung geltend gemacht werden:&nbsp;&nbsp;Das Spezialticket ist bei Vorlage einer g&uuml;ltigen Z&uuml;rich Card (und bis max. 7 Tage nach G&uuml;ltigkeitsdatum) an jeder Verkaufsstelle der Jungfraubahnen, in der Tourist Information am Hauptbahnhof Z&uuml;rich oder &uuml;ber den praktischen <a href=""https://www.jungfrau.ch/de-ch/zuerich-card/"">Webshop</a> zu beziehen. Die Reise aufs Jungfraujoch - Top of Europe muss innerhalb der genannten Zeitspanne erfolgen.&nbsp;&nbsp;</p><p>Als zus&auml;tzliches Geschenk erhalten G&auml;ste, die eine Z&uuml;rich Card besitzen, 10% Erm&auml;ssigung in den &laquo;Top of Europe Souvenirs Shops&raquo; in Interlaken, Grindelwald Terminal, First und Jungfraujoch &ndash; Top of Europe.&nbsp;&nbsp;</p></p>', 'en': '<p>Smart travelers can save 15% on a day trip to the spectacular Jungfraujoch! All you require is a valid <a href=""https://www.zuerich.com/en/zurichcard"">Z&uuml;rich Card</a>. &nbsp;<p><strong>Here&rsquo;s What You Need to Do:&nbsp;</strong></p><p>Buy a train ticket at the standard fare from Zurich Main Station to Interlaken Ost or Grindelwald Terminal. You can do this at all SBB ticket machines, at a SBB ticket counter, via the SBB app, or at the Tourist Information at Zurich Main Station. &nbsp;</p><p>The 15% discount can be claimed for the onward journey from Interlaken Ost or Grindelwald Terminal up to the Jungfraujoch. The special ticket is available on presentation of a valid Z&uuml;rich Card (and for a maximum of 7 days after the expiry date) at any Jungfraubahnen point of sale, at the Tourist Information at Zurich Main Station, or quickly and easily via the <a href=""https://www.jungfrau.ch/en-gb/zuerich-card/"">online shop</a>. The trip up to the Jungfraujoch &ndash; Top of Europe must take place within the specified period.&nbsp;&nbsp;&nbsp;</p><p>As an additional gift, visitors in possession of a Z&uuml;rich Card receive 10% discount on souvenirs in the Top of Europe Flagship Stores in Interlaken, Grindelwald Terminal, Grindelwald-First, and Jungfraujoch &ndash; Top of Europe.&nbsp;</p></p>', 'fr': '<p>Planifier intelligemment, c&rsquo;est &eacute;conomiser 15% sur l&rsquo;excursion d&rsquo;une journ&eacute;e au Jungfraujoch, un site unique en son genre&nbsp;! Tout ce qu&rsquo;il vous faut, c&rsquo;est une <a href=""https://www.zuerich.com/fr/zurichcard"">Z&uuml;rich Card</a> valable. &nbsp;<p><strong>Comment proc&eacute;der&nbsp;? &nbsp;</strong></p><p>Achetez un billet de train au tarif normal depuis la gare centrale de Zurich jusqu\'&agrave; Interlaken Ost ou Grindelwald Terminal. Vous pouvez le faire &agrave; tous les distributeurs de billets des CFF, aux guichets CFF, sur l&rsquo;application CFF ou &agrave; la Tourist Information de la gare centrale de Zurich. &nbsp;</p><p>Pour la suite du voyage &agrave; partir d&rsquo;Interlaken Ost ou du terminal de Grindelwald jusqu&rsquo;en haut du Jungfraujoch, vous pouvez faire valoir la r&eacute;duction de 15%&nbsp;: le billet sp&eacute;cial est disponible sur pr&eacute;sentation d&rsquo;une Z&uuml;rich Card valable (et jusqu&rsquo;&agrave; 7 jours maximum apr&egrave;s la date de validit&eacute;) dans tous les points de vente des chemins de fer de la Jungfrau, &agrave; la Tourist Information de la gare centrale de Zurich ou via la <a href=""https://www.jungfrau.ch/fr-ch/zuerich-card/"">boutique en ligne</a> tr&egrave;s pratique. Le voyage au Jungfraujoch &ndash; Top of Europe doit &ecirc;tre effectu&eacute; dans les d&eacute;lais susmentionn&eacute;s.&nbsp;&nbsp;</p><p>En guise de cadeau suppl&eacute;mentaire, les clients en possession d&rsquo;une Z&uuml;rich Card b&eacute;n&eacute;ficient d&rsquo;une r&eacute;duction de 10% dans les boutiques &laquo;&nbsp;Top of Europe Souvenis Shops&nbsp;&raquo; &agrave; Interlaken, Grindelwald Terminal, First et Jungfraujoch &ndash; Top of Europe.&nbsp;</p></p>', 'it': '<p>Pianificando con astuzia, si pu&ograve; risparmiare il 15% sulla gita giornaliera in vetta allo spettacolare Jungfraujoch! Tutto ci&ograve; che serve &egrave; una <a href=""https://www.zuerich.com/it/zurichcard"">Z&uuml;rich Card</a> in corso di validit&agrave;. &nbsp;<p><strong>Ecco come fare: &nbsp;</strong><br><br> Dalla Stazione Centrale di Zurigo &egrave; necessario acquistare un biglietto ferroviario a tariffa standard fino a Interlaken Ost o Grindelwald Terminal. Lo si pu&ograve; fare presso tutte le biglietterie automatiche delle FFS, gli sportelli delle FFS, nella app delle FFS o alla Tourist Information nella Stazione Centrale di Zurigo. &nbsp;</p><p>Per proseguire il viaggio da Interlaken Ost o Grindelwald Terminal fino in cima allo Jungfraujoch, &egrave; possibile ottenere uno sconto del 15%: il biglietto speciale pu&ograve; essere ottenuto esibendo una Z&uuml;rich Card in corso di validit&agrave; (e fino a un massimo di 7 giorni dopo la data di validit&agrave;) presso tutti i punti vendita della Ferrovia della Jungfrau, alla Tourist Information nella Stazione Centrale di Zurigo, o tramite il pratico <a href=""http://www.jungfrau.ch/zurichcard"">shop online</a>. La corsa sullo Jungfraujoch - Top of Europe deve avvenire nel periodo indicato.&nbsp;&nbsp;</p><p>Inoltre, gli ospiti in possesso di una Z&uuml;rich Card ricevono anche il 10% di sconto nei &ldquo;Top of Europe Souvenis Shops&rdquo; di Interlaken, Grindelwald Terminal, First e Jungfraujoch &ndash; Top of Europe.&nbsp;</p></p>'}","{'de': 'Jungfraujoch mit Zürich Card', 'en': 'Jungfraujoch with the Zürich Card', 'fr': 'Jungfraujoch avec la Zürich Card', 'it': 'Jungfraujoch con la Zürich Card'}","{'de': '15% günstiger aufs Jungfraujoch – diese einmalige Preisreduktion gibt’s mit der Zürich Card.', 'en': '15% off a trip to the Jungfraujoch: this amazing price reduction is available with the Zürich Card.', 'fr': 'Avec 15% de réduction au Jungfraujoch – uniquement avec la Zürich Card !', 'it': '15% di sconto per arrivare sullo Jungfraujoch: un’agevolazione unica grazie alla Zürich Card.'}","{'de': ['Günstiger aufs Jungfraujoch', 'Tagesausflug in die Schweizer Bergwelt', ""3'454 Meter über Meer ""], 'en': ['Pay less to travel up to the Jungfraujoch', 'Day trip into the Swiss mountains', '3,454 m (11,332 ft) above sea level'], 'fr': ['Excursion au Jungfraujoch à prix réduit', 'Une journée dans les montagnes suisses', '3454 mètres d’altitude'], 'it': ['Sullo Jungfraujoch spendendo meno', 'Gita giornaliera sulle montagne svizzere', '3.454 metri sopra il mare']}","{'de': '15% Ermässigung mit der Zürich Card', 'en': '15% discount with the Zürich Card', 'fr': '15% de réduction avec la Zürich Card', 'it': '15% di sconto con la Zürich Card'}",True,,"{'url': 'https://www.zuerich.com/sites/default/files/image/2023/web_zuerich_jungfraujoch_50412.jpg', 'caption': {'de': 'Jungfraujoch', 'en': 'Jungfraujoch', 'fr': 'Jungfraujoch', 'it': 'Jungfraujoch'}}","{'de': None, 'en': None, 'fr': None, 'it': None}","[{'url': 'https://www.zuerich.com/sites/default/files/image/2022/web_zuerich_tour_jungfraujoch_1280x960_42923.jpg', 'caption': {'de': 'Jungfraujoch', 'en': 'Jungfraujoch', 'fr': None, 'it': None}}, {'url': 'https://www.zuerich.com/sites/default/files/image/2022/web_zuerich_tour_jungfraujochbahn_1280x960_42922.jpg', 'caption': {'de': 'Jungfraujochbahn', 'en': 'Jungfraujoch train', 'fr': None, 'it': None}}]",2024-10-14T15:56,[],"['Su,Mo,Tu,We,Th,Fr,Sa 08:00:00-16:50:00']",,"{'de': None, 'en': None, 'fr': None, 'it': None}","{'addressCountry': 'CH', 'addressLocality': 'Grindelwald', 'postalCode': '3818', 'streetAddress': 'Eigergletscher-Jungfraujoch', 'telephone': '+41 33 828 72 33', 'email': 'info@jungfrau.ch', 'url': 'https://www.jungfrau.ch/de-ch/jungfraujoch-top-of-europe/'}","{'latitude': 46.547539504451, 'longitude': 7.9851704701986}",[]
https://schema.org/,LocalBusiness,,1011189,"{'de': 'Zürich Tourismus www.zuerich.com', 'en': 'Zurich Tourism www.zuerich.com', 'it': 'Zürich Tourismo www.zuerich.com', 'fr': 'Zürich Tourisme www.zuerich.com'}",CC BY-SA,,"{'Place': {'swissId': ''}, 'Attractions': {'swissId': ''}, 'Works of Art': {'swissId': ''}}","{'de': 'Urban Art am Flughafen Zürich', 'en': 'Urban Art at Zurich Airport', 'fr': 'Art urbain à l’aéroport de Zurich', 'it': 'Urban Art all’aeroporto di Zurigo'}","{'de': 'Drei Kunstwerke, drei Stile von drei Schweizer Künstler:innen: im Durchgang zwischen dem Airport Shopping und dem «The Circle».', 'en': 'Three artworks, three styles by three Swiss artists: now decorating the underground passage between Airport Shopping and the Circle.', 'fr': 'Trois œuvres d’art, trois styles, trois artistes suisses : à découvrir dans le passage entre l’Airport Shopping et The Circle.', 'it': 'Tre opere d’arte, tre stili di tre artisti svizzeri diversi: tutto ciò si può scoprire nel sottopassaggio tra l’Airport Shopping e il The Circle.'}","{'de': '<h3>Onur Dinc<p>Der in Berlin lebende Solothurner K&uuml;nstler schafft fotorealistische Kunstwerke. In seinen Gem&auml;lden setzt er die vier Jahreszeiten der Schweiz in den Fokus und widerspiegelt den Unternehmenszweck der Flughafen Z&uuml;rich AG.</p><h3>Fabian &laquo;BANE&raquo; Florin</h3><p>Der aus Chur stammende &laquo;BANE&raquo; ist einer der erfolgreichsten K&uuml;nstler der Urban Art Szene der Schweiz. Sein Werk l&auml;sst die Besucher:innen in eine neue Welt eintauchen, in der sie sich v&ouml;llig fallen lassen k&ouml;nnen. Ein Fotoshooting in einem Hallenbad diente als Vorlage f&uuml;r sein Kunstwerk.</p><h3>Sarah &laquo;SAFU&raquo; Furrer</h3><p>In ihren Werken am Flughafen Z&uuml;rich kombiniert die Z&uuml;rcher K&uuml;nstlerin Illustration und Grafikdesign. Dabei stellt sie das Zusammenspiel von Mond, Mensch, Tier und Natur in den Mittelpunkt. Als Vorlage f&uuml;r das Bild diente ein Gedicht eines Freundes der K&uuml;nstlerin:</p><p>&laquo;The Circle<br> of day and night<br> moon and water<br> moth and bee<br> traversing the globe<br> circling the sun&raquo;</p></h3>', 'en': '<h3>Onur Dinc<p>The artist, who grew up in Solothurn and lives in Berlin, creates photorealistic artworks. In his paintings, he focuses on the four seasons in Switzerland and reflects the core purpose of the Zurich Airport corporation.</p><h3>Fabian &ldquo;BANE&rdquo; Florin</h3><p>BANE, who comes from Chur, is one of the most successful artists in Switzerland&rsquo;s urban art scene. His artworks immerse the observer in a new world where they can completely let go. A photoshoot in an indoor swimming pool served as a template for his mural.</p><h3>Sarah &ldquo;SAFU&rdquo; Furrer</h3><p>In her works at Zurich Airport, the Zurich-based artist combines illustrations and graphic design. She focuses on the interplay between the moon, humans, animals, and nature. A poem by a friend of the artist describes the idea behind the mural perfectly:</p><p>&ldquo;The Circle<br> of day and night<br> moon and water<br> moth and bee<br> traversing the globe<br> circling the sun&rdquo;</p></h3>', 'fr': '<h3>Onur Dinc<p>L&rsquo;artiste soleurois, qui vit &agrave; Berlin, cr&eacute;e des &oelig;uvres d&rsquo;art photor&eacute;alistes. Dans ses peintures, il met en sc&egrave;ne les quatre saisons de la Suisse et refl&egrave;te artistiquement la devise de l&rsquo;entreprise Flughafen Z&uuml;rich AG.</p><h3>Fabian &laquo;&nbsp;BANE&nbsp;&raquo; Florin</h3><p>Originaire de Coire, &laquo;&nbsp;BANE&nbsp;&raquo; est l&rsquo;un des artistes les plus c&eacute;l&egrave;bres de la sc&egrave;ne de l&rsquo;art urbain en Suisse. Son &oelig;uvre plonge les visiteurs et visiteuses dans un nouveau monde dans lequel ils peuvent se laisser emporter. C&rsquo;est une s&eacute;ance photo dans une piscine couverte qui a servi de mod&egrave;le &agrave; son &oelig;uvre d&rsquo;art.</p><h3>Sarah &laquo;&nbsp;SAFU&nbsp;&raquo; Furrer</h3><p>Dans ses &oelig;uvres &agrave; l&rsquo;a&eacute;roport de Zurich, l&rsquo;artiste zurichoise combine illustration et design graphique. Elle met l&rsquo;accent sur l&rsquo;interaction entre la lune, les humains, les animaux et la nature. Un po&egrave;me d&rsquo;un ami lui a servi de source d&rsquo;inspiration pour la peinture&nbsp;:</p><p>&laquo; The Circle<br> of day and night<br> moon and water<br> moth and bee<br> traversing the globe<br> circling the sun &raquo;</p></h3>', 'it': '<h3>Onur Dinc<p>Residente a Berlino, l&rsquo;artista di Soletta crea arte fotorealistica. Nelle sue opere, mette in primo piano le quattro stagioni della Svizzera, rispecchiando lo scopo aziendale della Flughafen Z&uuml;rich AG.</p><h3>Fabian &ldquo;BANE&rdquo; Florin</h3><p>Originario di Coira, &ldquo;BANE&rdquo; &egrave; uno degli artisti di maggiore successo del panorama di Urban Art della Svizzera. La sua opera consente a chi la guarda di immergersi in un nuovo mondo, nel quale &egrave; possibile lasciarsi completamente andare. Un servizio fotografico in una piscina coperta ha rappresentato la base dell&rsquo;opera.</p><h3>Sarah &ldquo;SAFU&rdquo; Furrer</h3><p>Nelle sue opere esposte all&rsquo;aeroporto di Zurigo, l&rsquo;artista zurighese combina illustrazioni e graphic design, ponendo al centro dell&rsquo;attenzione le interazioni tra luna, esseri umani, animali e natura. La base del dipinto &egrave; stata una poesia di un amico dell&rsquo;artista:</p><p>&ldquo;The Circle<br> of day and night<br> moon and water<br> moth and bee,<br> traversing the globe&nbsp;<br> circling the sun&rdquo;</p></h3>'}","{'de': 'Urban Art am Flughafen Zürich', 'en': 'Urban Art at Zurich Airport', 'fr': 'Art urbain à l’aéroport de Zurich', 'it': 'Urban Art all’aeroporto di Zurigo'}","{'de': 'Ein idealer Ort für Urban Art. Passend einerseits zum Mikrokosmos Flughafen und andererseits zum neuen, urbanen Quartier, dem Circle.', 'en': 'An ideal place for urban art – a fitting concept for the microcosm of the airport, as well as the Circle as a new, urban district.', 'fr': 'Un lieu idéal pour l’art urbain, convenant d’une part au microcosme de l’aéroport et de l’autre au nouveau quartier urbain The Circle.', 'it': 'Un lieu idéal pour l’art urbain, convenant d’une part au microcosme de l’aéroport et de l’autre au nouveau quartier urbain The Circle.'}","{'de': ['Street-Art Kunstwerke', 'Flughafen Zürich', 'Drei Künstler:innen'], 'en': ['Street Art Artworks', 'Zurich Airport', 'Three artists'], 'fr': ['Œuvres d’art urbain ', 'Aéroport de Zurich', 'Trois artistes '], 'it': ['Capolavori di Street Art', 'The Circle aeroporto di Zurigo', 'Tre artisti']}",,False,,"{'url': 'https://www.zuerich.com/sites/default/files/image/2023/web_zuerich_urbanart_flughafen_zuerich_1280x960_47447.jpg', 'caption': {'de': 'Urban Art am Flughafen Zürich – Fabian «BANE» Florin', 'en': None, 'fr': None, 'it': None}}","{'de': None, 'en': None, 'fr': None, 'it': None}","[{'url': 'https://www.zuerich.com/sites/default/files/image/2023/web_zuerich_urbanart_flughafen_zuerich_1280x960_47436.jpg', 'caption': {'de': 'Urban Art am Flughafen Zürich – Onur Dinc', 'en': None, 'fr': None, 'it': None}}, {'url': 'https://www.zuerich.com/sites/default/files/image/2023/web_zuerich_urbanart_flughafen_zuerich_1280x960_47437.jpg', 'caption': {'de': 'Urban Art am Flughafen Zürich – Onur Dinc', 'en': None, 'fr': None, 'it': None}}, {'url': 'https://www.zuerich.com/sites/default/files/image/2023/web_zuerich_urbanart_flughafen_zuerich_1280x960_47438.jpg', 'caption': {'de': 'Urban Art am Flughafen Zürich – Onur Dinc', 'en': None, 'fr': None, 'it': None}}, {'url': 'https://www.zuerich.com/sites/default/files/image/2023/web_zuerich_urbanart_flughafen_zuerich_1280x960_47448.jpg', 'caption': {'de': 'Urban Art am Flughafen Zürich – Fabian «BANE» Florin', 'en': None, 'fr': None, 'it': None}}, {'url': 'https://www.zuerich.com/sites/default/files/image/2023/web_zuerich_urbanart_flughafen_zuerich_1280x960_47444.jpg', 'caption': {'de': 'Urban Art am Flughafen Zürich – Fabian «BANE» Florin', 'en': None, 'fr': None, 'it': None}}, {'url': 'https://www.zuerich.com/sites/default/files/image/2023/web_zuerich_urbanart_flughafen_zuerich_1280x960_47446.jpg', 'caption': {'de': 'Urban Art am Flughafen Zürich – Fabian «BANE» Florin', 'en': None, 'fr': None, 'it': None}}, {'url': 'https://www.zuerich.com/sites/default/files/image/2023/web_zuerich_urbanart_flughafen_zuerich_1280x960_47443.jpg', 'caption': {'de': 'Urban Art am Flughafen Zürich – Sarah «SAFU» Furrer', 'en': None, 'fr': None, 'it': None}}, {'url': 'https://www.zuerich.com/sites/default/files/image/2023/web_zuerich_urbanart_flughafen_zuerich_1280x960_47441.jpg', 'caption': {'de': 'Urban Art am Flughafen Zürich – Sarah «SAFU» Furrer', 'en': None, 'fr': None, 'it': None}}, {'url': 'https://www.zuerich.com/sites/default/files/image/2023/web_zuerich_urbanart_flughafen_zuerich_1280x960_47440.jpg', 'caption': {'de': 'Urban Art am Flughafen Zürich – Sarah «SAFU» Furrer', 'en': None, 'fr': None, 'it': None}}]",2024-10-14T15:56,,,,"{'de': 'Rund um die Uhr geöffnet', 'en': 'Open around the clock', 'it': 'Aperti tutto il giorno', 'fr': 'Ouvert 24 heures sur 24'}","{'addressCountry': 'CH', 'addressLocality': 'Zürich-Flughafen', 'postalCode': '8058', 'streetAddress': '', 'telephone': None, 'email': None, 'url': 'https://www.flughafen-zuerich.ch/de/passagiere/erleben/erlebnisse/urbanart'}","{'latitude': 47.450098, 'longitude': 8.561898}",[]
