@context,@type,@customType,identifier,copyrightHolder,license,tomasBookingId,category,name,disambiguatingDescription,description,titleTeaser,textTeaser,detailedInformation,zurichCardDescription,zurichCard,osm_id,image,price,photo,dateModified,opens,openingHours,openingHoursSpecification,specialOpeningHoursSpecification,address,geoCoordinates,place
https://schema.org/,SportsActivityLocation,,153178,"{'de': 'Zürich Tourismus www.zuerich.com', 'en': 'Zurich Tourism www.zuerich.com', 'it': 'Zürich Tourismo www.zuerich.com', 'fr': 'Zürich Tourisme www.zuerich.com'}",CC BY-SA,,"{'Place': {'swissId': ''}, 'Attractions': {'swissId': ''}, 'Architecture': {'swissId': 'sui_0202'}, 'Vantage Points': {'swissId': ''}, 'Squares & Streets': {'swissId': ''}, 'Sport': {'swissId': 'sui_01'}, 'Walks': {'swissId': 'sui_010110'}}","{'de': 'Cassiopeiasteg', 'en': 'Cassiopeia Boardwalk', 'fr': 'Passerelle Cassiopeiasteg', 'it': 'Passerella Cassiopeiasteg'}","{'de': 'Dank dem Cassiopeiasteg können Spaziergänger:innen und Läufer:innen fast das ganze städtische linke Seeufer ohne Unterbruch abschreiten.', 'en': 'The Cassiopeia boardwalk enables pedestrians and joggers to follow a route all the way along the left bank of Lake Zurich without interruption. ', 'fr': 'La passerelle Cassiopeiasteg permet aux promeneurs et aux coureurs de longer presque toute la zone urbaine zurichoise sur la rive gauche du lac. ', 'it': 'Grazie a questa passerella (Cassiopeiasteg), è possibile percorrere senza interruzioni quasi tutta la sponda lacustre sinistra della città.'}","{'de': '<p>Der 2.8 Meter breite und 284 Meter lange Cassiopeiasteg schliesst die L&uuml;cke im Uferweg zwischen dem alternativen Kulturzentrum Rote Fabrik und dem Hafen Wollishofen. Dadurch ist es Fussg&auml;nger:innen und L&auml;ufer:innen m&ouml;glich, vom B&uuml;rkliplatz aus durchgehend auf einem h&uuml;bschen Uferweg entlang des Z&uuml;richsees bis an die Stadtgrenze in Wollishofen zu laufen.<p>Die h&uuml;bsche und leichtf&uuml;ssige Konstruktion f&uuml;hrt 100 Meter in den See hinaus, von wo aus man sich dem Alpenpanorama noch n&auml;her f&uuml;hlt als bereits von der Quaibr&uuml;cke beim B&uuml;rkliplatz aus. Zudem vermittelt das Band zwischen Land und Wasser den Spazierg&auml;nger:innen das Gef&uuml;hl, mitten im See zu stehen. In der Nacht ist der Steg &uuml;brigens nicht beleuchtet, warum sich bei klarem Wetter ein besonders h&uuml;bscher Blick in den Sternenhimmel bietet. Dann sehen kleine und grosse Astronomen unter anderem das Sternbild Cassiopeia, welches dem Holzsteg seinen Namen gegeben hat.&nbsp;</p></p>', 'en': '<p>The 2.8m (92ft) wide and 284m (932ft) long Cassiopeia boardwalk closes the gap in the lakeside path between the center for alternative culture, the Rote Fabrik, and Wollishofen Harbor. Pedestrians and joggers can now follow a route without interruption along the picturesque lakeshore from B&uuml;rkliplatz in central Zurich as far as the municipal boundary in Wollishofen.<p>The attractive construction extends 100m (330ft) into the lake, making the Alpine panorama seem even closer than from the Quaibr&uuml;cke bridge at B&uuml;rkliplatz. In addition, the narrow walkway between land and water gives you the feeling that you are actually standing in the middle of the lake. Incidentally, the boardwalk is lit up at night, offering a particular good view of the starry sky in fine weather. Then budding astronomers both big and small can see, among other things, the constellation Cassiopeia, which has lent the boardwalk its name.</p></p>', 'fr': '<p>La passerelle Cassiopeiasteg, 2,8 m&egrave;tres de large et 284 m&egrave;tres de long, prolonge le chemin de rive du centre culturel alternatif Rote Fabrik jusqu&rsquo;au port de Wollishofen. Elle permet aux pi&eacute;tons et aux coureurs de parcourir la jolie promenade au bord du lac de Zurich sans interruption, de la B&uuml;rkliplatz jusqu&rsquo;&agrave; la fronti&egrave;re de la ville &agrave; Wollishofen.<p>La belle construction gracieuse emm&egrave;ne les passants &agrave; 100 m&egrave;tres du bord du lac. Ainsi, le panorama alpin semble encore plus pr&egrave;s que lorsqu&rsquo;on se trouve sur le pont Quaibr&uuml;cke pr&egrave;s de la B&uuml;rkliplatz et on a l&rsquo;impression de se promener au milieu du lac. La nuit, la passerelle n&rsquo;est pas &eacute;clair&eacute;e et offre, par temps clair, des belles vues d&eacute;gag&eacute;es sur le ciel &eacute;toil&eacute;. Petits et grands astronomes ont alors la possibilit&eacute; d&rsquo;observer la constellation Cassiopeia qui a donn&eacute; son nom &agrave; la passerelle en bois.</p></p>', 'it': '<p>Larga 2,8 e lunga 284 metri, la passerella Cassiopeiasteg colma la lacuna nel sentiero rivierasco tra il centro culturale alternativo Rote Fabrik e il porto di Wollishofen. In questo modo, chi lo desidera pu&ograve; andare dalla B&uuml;rkliplatz fino al confine urbano di Wollishofen percorrendo un grazioso percorso in riva al Lago di Zurigo.<p>La costruzione si estende per 100 metri all&rsquo;interno del lago, permettendo di ammirare ancora pi&ugrave; da vicino il panorama alpino rispetto al ponte Quaibr&uuml;cke sulla B&uuml;rkliplatz. Chi percorre la passerella ha la sensazione di trovarsi nel bel mezzo del lago. Di notte non &egrave; illuminata, dettaglio che regala stellate particolarmente suggestive quando il cielo &egrave; sereno. Piccoli e grandi astronomi possono cos&igrave; ammirare, tra le altre cose, la costellazione di Cassiopea, che d&agrave; il nome alla passerella.&nbsp;</p></p>'}","{'de': 'Cassiopeiasteg', 'en': 'Cassiopeia Boardwalk ', 'fr': 'Passerelle Cassiopeiasteg', 'it': 'Passerella Cassiopeia'}","{'de': 'Der 284 Meter lange Steg im Zürichsee verbindet die Rote Fabrik mit dem Hafen Wollishofen.', 'en': 'The 284m (932ft) long boardwalk on Lake Zurich links the Rote Fabrik with Wollishofen Harbor.', 'fr': 'La passerelle de 284 m, construite sur le lac de Zurich, relie la Rote Fabrik au port de Wollishofen.', 'it': 'La passerella lunga 284 metri sul lago di Zurigo collega la Rote Fabrik al porto di Wollishofen.'}","{'de': ['Steg über den Zürichsee', 'Direkt zwischen Rote Fabrik und Strandbad Wollishofen', 'Erholung am Wasser'], 'en': ['Boardwalk over the water', 'Directly between the Rote Fabrik and the Wollishofen lido', 'Relaxation by Lake Zurich'], 'fr': ['Passerelle sur le lac de Zurich', 'Juste entre la Rote Fabrik et la zone de baignade de Wollishofen ', 'Juste entre la Rote Fabrik et la zone de baignade de Wollishofen'], 'it': ['Passerella sul Lago di Zurigo', 'Tra la Rote Fabrik e lo stabilimento balneare Wollishofen', 'Relax in riva all’acqua']}",,False,343125467,"{'url': 'https://www.zuerich.com/sites/default/files/keyvisual/web_cassiopeia_steg.jpg', 'caption': {'de': 'Cassiopeiasteg', 'en': 'Cassiopeia Boardwalk', 'fr': None, 'it': None}}","{'de': None, 'en': None, 'fr': None, 'it': None}",,2024-11-20T16:27,,,,"{'de': 'Rund um die Uhr geöffnet', 'en': 'Open around the clock', 'it': 'Aperti tutto il giorno', 'fr': 'Ouvert 24 heures sur 24'}","{'addressCountry': 'CH', 'addressLocality': 'Zürich', 'postalCode': '8038', 'streetAddress': '', 'telephone': None, 'email': None, 'url': None}","{'latitude': 47.34286, 'longitude': 8.53722}",[]
https://schema.org/,TouristAttraction,,120463,"{'de': 'Zürich Tourismus www.zuerich.com', 'en': 'Zurich Tourism www.zuerich.com', 'it': 'Zürich Tourismo www.zuerich.com', 'fr': 'Zürich Tourisme www.zuerich.com'}",CC BY-SA,,{'Attractions': {'swissId': ''}},"{'de': 'Märlitram', 'en': 'Märlitram', 'fr': 'Märlitram', 'it': 'Märlitram'}","{'de': 'Der schönste Zeitvertreib für Kinder ist im Advent das Märlitram. Damit kurven sie durch die Innenstadt, während Engel ihnen Märchen vorlesen.', 'en': 'For children, the best way to enjoy Advent is on a trip in the ""Märlitram"". Angels read their young passengers Christmas stories while the festively decorated streetcar trundles through the city.', 'fr': 'Pendant l’Avent, le plus beau passe-temps pour enfants est de traverser la ville en Märlitram en écoutant des contes de fées racontés par des anges.', 'it': 'Durante l’Avvento, i bambini viaggiano sul Märlitram, a bordo del quale attraversano la città ascoltando i racconti letti dagli angeli.'}","{'de': '<p>F&uuml;r einmal l&auml;sst der &laquo;Samichlaus&raquo; seine Rentiere im Stall stehen und steigt auf die Strassenbahn um. W&auml;hrend er mit dem &laquo;M&auml;rlitram&raquo; (M&auml;rchen-Tram) durch die Strassen kurvt, lauschen die gespannten Passagiere &ndash; mitfahren d&uuml;rfen ausschliesslich Kinder zwischen 4 und 9 Jahren &ndash; den Weihnachts-M&auml;rchen, die zwei Engel ihnen vorlesen.<p>Die Tickets k&ouml;nnen ab dem 15. November 2024&nbsp;<a href=""https://www.jelmoli.ch/maerlitram"">online</a> gekauft werden.&nbsp;</p><p>Die Haltestelle &laquo;M&auml;rlitram&raquo; befindet sich am Bellevue.&nbsp;</p></p>', 'en': '<p>Santa leaves his reindeers in the stable for a change and instead opts for a different form of transport. While he drives the M&auml;rlitram streetcar through the streets of Zurich, his young passengers &ndash; all of them children aged between 4 and 9 years &ndash; listen in wonder to Christmas stories told by two angels.<p>Tickets can be purchased <a href=""https://www.jelmoli.ch/maerlitram"">online </a>from November 15, 2024.&nbsp;</p><p>The beautifully decorated M&auml;rlitram departs from Bellevue.</p></p>', 'fr': '<p>Pour une fois, le p&egrave;re No&euml;l &eacute;change ses rennes contre un tramway. Pendant qu&rsquo;il traverse la ville en tramway de contes, M&auml;rlitram, les passagers passionn&eacute;s &ndash; des enfants entre 4 et 9 ans &ndash; &eacute;coutent les contes de f&eacute;es racont&eacute;s par deux anges.<p>Les billets peuvent &ecirc;tre achet&eacute;s&nbsp;<a href=""https://www.jelmoli.ch/maerlitram"">en ligne</a> &agrave; partir du 15 novembre 2024.</p><p>L&rsquo;arr&ecirc;t &laquo; M&auml;rlitram &raquo; est situ&eacute; &agrave; Bellevue.</p></p>', 'it': '<p>Per una volta, Babbo Natale lascia le renne nella stalla e sale a bordo di un tram. Mentre guida il&nbsp; &ldquo;M&auml;rlitram&rdquo;, il tram delle favole, per le strade della citt&agrave;, i curiosi passeggeri (esclusivamente bambini tra i 4 e i 9 anni) ascoltano le favole natalizie lette da due angeli.<p>I biglietti possono essere acquistati <a href=""https://www.jelmoli.ch/maerlitram"">online</a> dal 15 novembre 2024.&nbsp;</p><p>La fermata &ldquo;M&auml;rlitram&rdquo; si trova sul Bellevue.&nbsp;</p></p>'}","{'de': 'Jelmoli Märlitram', 'en': 'Jelmoli Märlitram', 'fr': 'Märlitram du Jemoli', 'it': 'Märlitram di Jelmoli'}","{'de': 'Der schönste Zeitvertreib für Kinder ist im Advent das Märlitram. ', 'en': 'For children, the best way to enjoy Advent is on a trip in the Märlitram. ', 'fr': 'Pendant l’Avent, le plus beau passe-temps pour enfants est de traverser la ville en Märlitram.', 'it': 'Durante l’Avvento, i bambini viaggiano sul Märlitram, a bordo del quale attraversano la città ascoltando i racconti letti dagli angeli.'}","{'de': ['Magisches Tram nur für Kinder', 'Für Kinder zwischen 4 – 9', 'Geschichten auf Deutsch'], 'en': ['Magical streetcar for children only', 'For children aged between 4 and 9 years', 'Stories in German'], 'fr': ['Tram magique uniquement pour enfants', 'Pour les enfants de 4 à 9 ans', 'Hitoires en allemand'], 'it': ['Tram magico solo per bambini', 'Per bambini da 4 a 9 anni', 'Racconti in tedesco']}",,False,496108586,"{'url': 'https://www.zuerich.com/sites/default/files/web_zuerich_maerlitram_23912.jpg', 'caption': {'de': 'Jelmoli Märlitram, Zürich', 'en': 'Jelmoli Märlitram, Zurich', 'fr': None, 'it': None}}","{'de': None, 'en': None, 'fr': None, 'it': None}",,2024-11-21T08:20,,,,"{'de': 'Saisonbedingt geschlossen bis Freitag, 22. November 2024.', 'en': 'Seasonally closed until Friday, 22 November 2024.', 'it': 'Chiuso stagionalmente a Venerdì 22 Novembre 2024.', 'fr': 'Fermeture saisonnière au Vendredi 22 novembre 2024.'}","{'addressCountry': 'CH', 'addressLocality': 'Zürich', 'postalCode': '8001', 'streetAddress': 'Bellevue', 'telephone': None, 'email': None, 'url': 'https://www.jelmoli.ch/maerlitram'}","{'latitude': 47.367213, 'longitude': 8.544765}",['Outdoors']
https://schema.org/,TouristAttraction,Viewpoint,75724,"{'de': 'Zürich Tourismus www.zuerich.com', 'en': 'Zurich Tourism www.zuerich.com', 'it': 'Zürich Tourismo www.zuerich.com', 'fr': 'Zürich Tourisme www.zuerich.com'}",CC BY-SA,,"{'Culture': {'swissId': 'sui_02'}, 'Museums': {'swissId': ''}, 'Cultural History': {'swissId': 'sui_0209'}, 'Attractions': {'swissId': ''}, 'Architecture': {'swissId': 'sui_0202'}, 'Vantage Points': {'swissId': ''}}","{'de': 'Schloss Regensberg', 'en': 'Regensberg Castle', 'fr': 'Château de Regensberg', 'it': 'Castello di Regensberg'}","{'de': 'Das Schloss Regensberg war einst Hauptsitz der Freiherren von Regensberg.', 'en': 'Regensberg Castle was once the ancestral seat of the House of Regensberg.', 'fr': 'Le château de Regensberg fut autrefois le fief des barons de Regensberg.', 'it': 'Il Castello di Regensberg è stato una delle sedi principali dei baroni di Regensberg. '}","{'de': '<p>Das Schloss Regensberg befindet sich in der gleichnamigen Gemeinde nordwestlich von Z&uuml;rich. Etwas erh&ouml;ht gelegen, befindet sich Regensberg am &ouml;stlichen Ausl&auml;ufer des L&auml;gerenkamms, welcher den Norden Z&uuml;richs mit Baden verbindet.<p>Das Schloss Regensberg pr&auml;gt die Region bereits seit dem 13. Jahrhundert. Die H&ouml;henburg sowie das darum gebaute St&auml;dtchen &ndash; beide bis heute ausserordentlich gut erhalten &ndash; waren einst Hauptsitz der Freiherren von Regensberg.</p><p>Heute geh&ouml;rt das Schloss der Stiftung Schloss Regensberg. &Ouml;ffentlich zug&auml;nglich ist noch der Rundturm, von welchem aus man eine herrliche Rundumsicht auf die umliegende Region geniesst. Ausserdem erkl&auml;ren Informationstafeln im Innern des Turms die Geschichte des Landst&auml;dtchens Regensberg.</p></p>', 'en': '<p>Regensberg Castle can be found in the municipality of the same name, situated to the north-west of Zurich. It lies in a somewhat elevated location on the eastern foothills of the L&auml;gern ridge, which links the north of Zurich with Baden.<p>Regensberg Castle has characterized the region since the 13th century. The castle and the small town built around it &ndash; both of which have been extremely well preserved &ndash; were once the ancestral seat of the House of Regensberg.</p><p>Nowadays, the castle belongs to the Regensberg Castle Foundation. The round tower is still open to the public and offers a spectacular panoramic view of the surrounding region. In addition, information panels inside the tower relate the history of the small country town of Regensberg.</p></p>', 'fr': '<p>Le ch&acirc;teau de Regensberg se situe &nbsp;dans la commune &eacute;ponyme, au nord-ouest de Zurich. Regensberg est situ&eacute; un peu plus en hauteur, &agrave; l&rsquo;extr&eacute;mit&eacute; orientale de la cr&ecirc;te du L&auml;gern qui relie le nord de Zurich avec Bade.<p>Le ch&acirc;teau de Regensberg marque la r&eacute;gion de son empreinte depuis le 13e si&egrave;cle. Extr&ecirc;mement bien conserv&eacute;s, le ch&acirc;teau-fort &eacute;rig&eacute; sur une hauteur et la petite ville qui l&rsquo;entoure furent autrefois le fief des barons de Regensberg.</p><p>Le ch&acirc;teau appartient aujourd&rsquo;hui &agrave; la fondation Schloss Regensberg. La tour ronde qui offre un superbe panorama sur la r&eacute;gion environnante est encore accessible au public. De plus, des panneaux d&rsquo;information &agrave; l&rsquo;int&eacute;rieur de la tour relatent l&rsquo;historique de la petite ville rurale de Regensberg.</p></p>', 'it': '<p>Il Castello di Regensberg si trova nell&rsquo;omonimo comune, a nord-ovest di Zurigo. In posizione leggermente rialzata, Regensberg &egrave; situata in corrispondenza della propaggine orientale dei L&auml;gern, che collegano il nord di Zurigo a Baden.<p>Il Castello di Regensberg caratterizza la regione gi&agrave; dal XIII secolo. La fortezza e la cittadina che la circonda, entrambe conservate incredibilmente bene ancora oggi, sono state una delle sedi principali dei baroni di Regensberg.</p><p>Oggi il castello appartiene alla Fondazione Castello di Regensberg. Accessibile al pubblico &egrave; la torre circolare, dalla quale si gode di una vista incantevole sulla regione circostante. Inoltre, le tavole informative all&rsquo;interno della torre illustrano la storia della cittadina di Regensberg.</p></p>'}","{'de': 'Schloss Regensberg', 'en': 'Regensberg Castle', 'fr': 'Château de Regensberg', 'it': 'Castello di Regensberg'}","{'de': 'Das Schloss Regensberg war einst Hauptsitz der Freiherren von Regensberg.', 'en': 'Regensberg Castle was once the ancestral seat of the House of Regensberg.', 'fr': 'Le château de Regensberg fut autrefois le fief des barons de Regensberg.', 'it': 'Il Castello di Regensberg è stato una delle sedi principali dei baroni di Regensberg. '}","{'de': ['Schloss aus dem 13. Jahrhundert', 'Heute Sitz einer Stiftung für Berufsintegration und Therapie', 'Nordwestlich von Zürich in Regensberg gelegen'], 'en': ['Castle from the 13th century', 'Now the seat of a foundation for vocational integration and therapy', 'Located northwest of Zurich in Regensberg'], 'fr': ['Château du XIIIe siècle', 'Aujourd’hui siège d’une fondation pour l’intégration professionnelle et la thérapie', 'À Regensburg au nord-ouest de Zurich'], 'it': ['Castello del XIII secolo', 'Oggi sede di una fondazione di integrazione professionale e terapia', 'Situato a Regensberg, a nord-ovest di Zurigo']}",,False,6405116864,"{'url': 'https://www.zuerich.com/sites/default/files/imagegallery/web_zurich_family_schloss-regensberg_06_0.jpg', 'caption': {'de': None, 'en': 'Schloss Regensberg', 'fr': None, 'it': None}}","{'de': '<div class=""table-container"">\r\n<table class=""is-fullwidth table"">\r\n\t<thead>\r\n\t\t<tr>\r\n\t\t\t<th>&nbsp;</th>\r\n\t\t\t<th>Eintritt</th>\r\n\t\t</tr>\r\n\t</thead>\r\n\t<tbody>\r\n\t\t<tr>\r\n\t\t\t<th>pro Person</th>\r\n\t\t\t<td>CHF 1</td>\r\n\t\t</tr>\r\n\t</tbody>\r\n</table>\r\n</div>\r\n', 'en': '<div class=""table-container"">\r\n<table class=""is-fullwidth table"">\r\n\t<thead>\r\n\t\t<tr>\r\n\t\t\t<th>&nbsp;</th>\r\n\t\t\t<th>Entry fee</th>\r\n\t\t</tr>\r\n\t</thead>\r\n\t<tbody>\r\n\t\t<tr>\r\n\t\t\t<th>per person</th>\r\n\t\t\t<td>CHF 1</td>\r\n\t\t</tr>\r\n\t</tbody>\r\n</table>\r\n</div>\r\n', 'fr': '<div class=""table-container"">\r\n<table class=""is-fullwidth table"">\r\n\t<thead>\r\n\t\t<tr>\r\n\t\t\t<th>&nbsp;</th>\r\n\t\t\t<th>Entrée</th>\r\n\t\t</tr>\r\n\t</thead>\r\n\t<tbody>\r\n\t\t<tr>\r\n\t\t\t<th>par personne</th>\r\n\t\t\t<td>CHF 1.00</td>\r\n\t\t</tr>\r\n\t</tbody>\r\n</table>\r\n</div>\r\n', 'it': '<div class=""table-container"">\r\n<table class=""is-fullwidth table"">\r\n\t<thead>\r\n\t\t<tr>\r\n\t\t\t<th>&nbsp;</th>\r\n\t\t\t<th>Entrata</th>\r\n\t\t</tr>\r\n\t</thead>\r\n\t<tbody>\r\n\t\t<tr>\r\n\t\t\t<th>a persona</th>\r\n\t\t\t<td>CHF 1</td>\r\n\t\t</tr>\r\n\t</tbody>\r\n</table>\r\n</div>\r\n'}","[{'url': 'https://www.zuerich.com/sites/default/files/imagegallery/web_zurich_family_schloss-regensberg_05.jpg', 'caption': {'de': None, 'en': 'Schloss Regensberg', 'fr': None, 'it': None}}, {'url': 'https://www.zuerich.com/sites/default/files/imagegallery/web_zurich_family_schloss-regensberg_02.jpg', 'caption': {'de': None, 'en': 'Schloss Regensberg', 'fr': None, 'it': None}}, {'url': 'https://www.zuerich.com/sites/default/files/imagegallery/web_zurich_family_schloss-regensberg_03.jpg', 'caption': {'de': None, 'en': 'Schloss Regensberg', 'fr': None, 'it': None}}, {'url': 'https://www.zuerich.com/sites/default/files/imagegallery/web_zurich_family_schloss-regensberg_04.jpg', 'caption': {'de': None, 'en': 'Schloss Regensberg', 'fr': None, 'it': None}}, {'url': 'https://www.zuerich.com/sites/default/files/imagegallery/web_zurich_family_schloss-regensberg_01.jpg', 'caption': {'de': None, 'en': 'Schloss Regensberg', 'fr': None, 'it': None}}]",2024-11-20T16:54,"['Monday', 'Tuesday', 'Wednesday', 'Thursday', 'Friday', 'Saturday', 'Sunday']","['Su,Sa 09:00:00-17:00:00', 'Mo,Tu,We,Th,Fr 08:00:00-20:00:00']",,"{'de': None, 'en': None, 'fr': None, 'it': None}","{'addressCountry': 'CH', 'addressLocality': 'Regensberg', 'postalCode': '8158', 'streetAddress': '', 'telephone': None, 'email': None, 'url': 'https://www.schlossregensberg.ch'}","{'latitude': 47.482764, 'longitude': 8.437404}","['Indoors', 'Outdoors']"
