,web-scraper-order,web-scraper-start-url,name,address,description,review_cat,price,no_reviews,Latitude,Longitude,total_distance,distance_score,no_reviews_num
0,1732027449-1,https://www.hotels-zurich.com/search/?sort=Rating&order=DESC&part=1&Name=11,Zurich Youth Hostel,"Mutschellenstrasse 114A, Zurich, Switzerland","Offering 421 rooms, the 2-star Zurich Youth Hostel boasts a location within 5 minutes' walk of Lake promenade. Located within 25 minutes' walk of Sechselautenplatz, this hostel offers guests…",Excellent,61 CHF,(4093 reviews),47.35028791,8.527832697,12.959401893350542,3,4093
1,1732027449-2,https://www.hotels-zurich.com/search/?sort=Rating&order=DESC&part=1&Name=11,Saint Georges Hotel,"Weberstrasse 11, Zurich, Switzerland","Located 15 km from Kloten airport, the 2-star Saint Georges Hotel Zurich features airport transfer service and car rentals for guests to take advantage of. The smoke-free hotel…",Excellent,114 CHF,(1894 reviews),47.37072945,8.528125829,11.8332641213504,4,1894
2,1732027449-3,https://www.hotels-zurich.com/search/?sort=Rating&order=DESC&part=1&Name=11,Ibis Zuerich City West,"Schiffbaustrasse 11, Zurich, Switzerland","A 10-minute drive from Old Town, the 3-star Ibis Zurich City West hotel offers a lift, a snack and drink vending machine. This Zurich hotel also includes a…",Good,143 CHF,(2135 reviews),47.3890558,8.5171575,13.561509725350518,2,2135
3,1732027449-4,https://www.hotels-zurich.com/search/?sort=Rating&order=DESC&part=1&Name=11,Hotel Seehof,"Seehofstrasse 11, Zurich, Switzerland","Featuring a currency exchange and a lift, the 3-star Hotel Seehof Zurich is located about 5 minutes' walk from Sechselautenplatz. This Zurich hotel is in Seefeld with a terrace…",Good,213 CHF,(949 reviews),47.36435985,8.547783378,11.303831001350432,4,949
4,1732027449-5,https://www.hotels-zurich.com/search/?sort=Rating&order=DESC&part=1&Name=11,Inside Five,"Motorenstrasse 11, Zurich, Switzerland","Located about a 5-minute walk from Markthalle, the comfortable 3-star Inside Five Aparthotel Zurich features a picnic area, barbecue grills, and a satellite flat-screen. Featuring a mini…",Good,112 CHF,(1977 reviews),47.3849765,8.529051288,12.334080637350464,3,1977
5,1732027449-6,https://www.hotels-zurich.com/search/?sort=Rating&order=DESC&part=1&Name=11,Swiss Star District 11 - Self Check-In,"Friesstrasse 33, Zurich, Switzerland","Situated just 13 minutes' walk from Messe Zurich, Swiss Star District 11 - Self Check-In Apartment provides guests with Wi-Fi for either business or leisure. There is Ottikerstrasse at…",Average,132 CHF,(296 reviews),47.4156855,8.54611803,14.036149225350629,1,296
6,1732027449-7,https://www.hotels-zurich.com/search/?sort=Rating&order=DESC&part=1&Name=11,Cozy Urban Studio In The City Be-11,"Bertastrasse 15, Zurich, Switzerland","12 m² Cozy Urban Studio In The City Be-11 is situated in the Wiedikon district, about a 25-minute walk from Circus Conelli, which is higly recommended for a…",Good,150 CHF,(5 reviews),47.37500035,8.515815823,12.86627974735039,3,5
7,1732027452-8,https://www.hotels-zurich.com/search/?sort=Rating&order=DESC&part=1&Name=10,Hotel Adler Zuerich,"Rosengasse 10, Zurich, Switzerland","Offering a restaurant and a storage room, the charming Hotel Adler Zurich lies in the Old Town district, just 600 metres from the compact Zurich Toy Museum and at a…",Excellent,207 CHF,(2166 reviews),47.37310225,8.543490983,10.946821457350463,5,2166
8,1732027452-9,https://www.hotels-zurich.com/search/?sort=Rating&order=DESC&part=1&Name=10,Sheraton Zuerich Hotel,"Pfingstweidstrasse 100, Zurich, Switzerland","The 4-star Sheraton Zurich Hotel is located in the heart of Zurich and features Wi-Fi in public areas, along with public parking on site. There is a train…",Good,283 CHF,(1013 reviews),47.3907286,8.5101238,14.309800325350572,1,1013
9,1732027452-10,https://www.hotels-zurich.com/search/?sort=Rating&order=DESC&part=1&Name=10,Boutique Hotel Wellenberg,"Niederdorfstrasse 10, Zurich, Switzerland","Boutique Hotel Wellenberg Zurich is located in the Old Town district, approximately a 5-minute walk from Limmat. The hotel features a safe deposit box and 24-hour security service…",Excellent,263 CHF,(3228 reviews),47.3729812,8.543859,10.946637725350378,5,3228
10,1732027452-11,https://www.hotels-zurich.com/search/?sort=Rating&order=DESC&part=1&Name=10,Sorell Hotel St. Peter,"In Gassen 10, Zurich, Switzerland","Located within 5 minutes' walk of the Romanesque-style Protestant church ""Grossmunster"", the 4-star Sorell Hotel St. Peter Zurich offers fitness classes, a terrace, and a shared lounge. This…",Excellent,268 CHF,(1446 reviews),47.37085145,8.540517702,10.984198041350371,5,1446
13,1732027452-14,https://www.hotels-zurich.com/search/?sort=Rating&order=DESC&part=1&Name=10,Leonardo Boutique Hotel Rigihof Zurich,"Universitatstrasse 101, Zurich, Switzerland","Located within 25 minutes' walk of Limmat River, the 4-star Leonardo Boutique Hotel Rigihof Zurich offers general facilities such as a bureau de change and a cash machine. This…",Good,137 CHF,(3983 reviews),47.3839381,8.548026119,11.576264961350503,4,3983
14,1732027452-15,https://www.hotels-zurich.com/search/?sort=Rating&order=DESC&part=1&Name=10,Hotel Hottingen,"Hottingerstrasse 31, Zurich, Switzerland","Offering a bureau de change and a vending machine, Hotel Hottingen Zurich is located only a 5-minute walk from Zurich Opera House. This 3-star hotel features Wi-Fi…",Excellent,140 CHF,(2469 reviews),47.3696756,8.553465,11.36200652535036,4,2469
15,1732027452-16,https://www.hotels-zurich.com/search/?sort=Rating&order=DESC&part=1&Name=10,Swiss Night By Fassbind,"Steinwiesstrasse 8-10, Zurich, Switzerland","The 3-star Swiss Night By Fassbind Hotel Zurich is located in Zürichberg with free wifi access and free private parking, within 5 minutes' drive of Limmat. Highlights at this…",Excellent,146 CHF,(2060 reviews),47.36911028,8.550444747,11.219211741350378,4,2060
17,1732027452-18,https://www.hotels-zurich.com/search/?sort=Rating&order=DESC&part=1&Name=10,Gaestehaus Hunziker,"Hagenholzstrasse 104B, Zurich, Ch, Zurich, Switzerland","Located 4.4 km from Lindenhof hill, which offers the thrill of discovering something beautiful, the 2-star Gastehaus Hunziker Hotel Zurich offers a restaurant and a barber shop. Private car…",Good,181 CHF,(708 reviews),47.4143829,8.5601597,14.63941292535037,1,708
19,1732027454-20,https://www.hotels-zurich.com/search/?sort=Rating&order=DESC&part=1&Name=9,Hotel Seidenhof,"Sihlstrasse 9, Zurich, Switzerland",The Hotel Seidenhof is part of the Sorell Hotels. The 16 individually designed and locally anchored houses are run by our hosts with a lot of passion. Our modern boutique…,Excellent,237 CHF,(2096 reviews),47.3735835,8.537231983,11.183837213350465,4,2096
20,1732027454-21,https://www.hotels-zurich.com/search/?sort=Rating&order=DESC&part=1&Name=9,Sorell Hotel Rex,"Weinbergstrasse 92, Zurich, Switzerland","Sorell Hotel Rex Zurich is located in the Unterstrass district, approximately a 5-minute walk from Sihl. This 3-star hotel provides a private parking garage for CHF 20 per…",Good,153 CHF,(2487 reviews),47.38476965,8.543062482,11.499804661350597,4,2487
21,1732027454-22,https://www.hotels-zurich.com/search/?sort=Rating&order=DESC&part=1&Name=9,Sorell Hotel Rigiblick - Studios & Spa Suites,"Germaniastrasse 99, Zurich, Switzerland",The 4-star Sorell Hotel Rigiblick - Studios & Spa Suites is situated in the Oberstrass district of Zurich and overlooks Alps. The smoke-free hotel is within 25 minutes' walk of…,Good,253 CHF,(225 reviews),47.3882288,8.553505966,12.146912621350404,3,225
22,1732027454-23,https://www.hotels-zurich.com/search/?sort=Rating&order=DESC&part=1&Name=9,Locke Am Platz Zurich,"Tessinerplatz 9, Zurich, Switzerland","Offering location approximately a 5-minute walk from Museum Rietberg, Locke Am Platz Zurich Hotel offers 81 rooms. This hotel entices guests with a private parking garage, available on site.",Excellent,232 CHF,(1066 reviews),47.36386065,8.532295501,11.79407545135042,4,1066
23,1732027454-24,https://www.hotels-zurich.com/search/?sort=Rating&order=DESC&part=1&Name=9,Numa I Craft Apartments,"9 Baeckerstrasse, Zurich, Switzerland",Numa I Craft Apartments Zurich hotel has 18 rooms and is located a mere 0.9 km from the modern FIFA World Football Museum.,Excellent,225 CHF,(553 reviews),47.3740704,8.5299301,11.721017925350449,4,553
25,1732027456-26,https://www.hotels-zurich.com/search/?sort=Rating&order=DESC&part=1&Name=8,Zurich Youth Hostel,"Mutschellenstrasse 114A, Zurich, Switzerland","Offering 421 rooms, the 2-star Zurich Youth Hostel boasts a location within 5 minutes' walk of Lake promenade. Located within 25 minutes' walk of Sechselautenplatz, this hostel offers guests…",Excellent,61 CHF,(4093 reviews),47.35028791,8.527832697,12.959401893350542,3,4093
27,1732027456-28,https://www.hotels-zurich.com/search/?sort=Rating&order=DESC&part=1&Name=8,Swiss Night By Fassbind,"Steinwiesstrasse 8-10, Zurich, Switzerland","The 3-star Swiss Night By Fassbind Hotel Zurich is located in Zürichberg with free wifi access and free private parking, within 5 minutes' drive of Limmat. Highlights at this…",Excellent,146 CHF,(2060 reviews),47.36911028,8.550444747,11.219211741350378,4,2060
28,1732027456-29,https://www.hotels-zurich.com/search/?sort=Rating&order=DESC&part=1&Name=8,Statthotel,"Schneggengasse 8, Zurich, Switzerland","Statthotel Zurich hotel offers 13 rooms in the vicinity of Lake Zurich, merely 8 minutes' walk away. Featuring a cash machine and a lift throughout the property, this hotel is…",Good,182 CHF,(1378 reviews),47.37233695,8.543175279,10.935627541350415,5,1378
29,1732027456-30,https://www.hotels-zurich.com/search/?sort=Rating&order=DESC&part=1&Name=8,Swiss Star Tower - Self Check-In,"Friesstrasse 8, Zurich, Switzerland","Swiss Star Tower - Self Check-In Apartment features convenient proximity to such city attractions as Ohne Titel Sculpture, situated 5 minutes' walk away. Wi-Fi is provided for both business…",Average,112 CHF,(2227 reviews),47.4140474,8.546997663,13.915779867350553,2,2227
30,1732027456-31,https://www.hotels-zurich.com/search/?sort=Rating&order=DESC&part=1&Name=8,Swiss Star Zurich University - Self Check-In,"Universitaetstrasse 80\/82, Zurich, Switzerland","Swiss Star Zurich University - Self Check-In, located in the Oberstrass district, within 20 minutes' walk of Wasserkirche Reformed Church, features views of the city. Guests can make use of…",Average,158 CHF,(911 reviews),47.3826103,8.5483744,11.51275092535063,4,911
31,1732027456-32,https://www.hotels-zurich.com/search/?sort=Rating&order=DESC&part=1&Name=8,Cozy Urban Studio In The City Be31,"Bertastrasse 15, Zurich, Switzerland","Situated in the Wiedikon district, 1-room Cozy Urban Studio In The City Be31 offers Wi-Fi and a car park nearby. Hive is around a 15-minute walk from…",Good,149 CHF,(6 reviews),47.37500035,8.515815823,12.86627974735039,3,6
32,1732027456-34,https://www.hotels-zurich.com/search/?sort=Rating&order=DESC&part=1&Name=8,City Flat,"Zaehringerplatz, 8001 Zuerich, Zurich, Switzerland",City Flat Apartment is located about a 15-minute walk from Swiss National Museum and about a 25-minute walk from Flussbad Oberer Letten Outdoor Swimming Pool. This apartment offers…,Excellent,402 CHF,(1 review),47.3735316,8.544989862,10.979927585350396,5,1
33,1732027456-35,https://www.hotels-zurich.com/search/?sort=Rating&order=DESC&part=1&Name=8,"Modernes Appartement ""Mayfair"" Zuerich Balgrist & Spital","Russenweg 8, Zurich, Switzerland",The 60 m² Mayfair Apartment is located approximately 2 km from Museum of Art and a 10-minute drive from Rote Fabrik Factory.,Excellent,217 CHF,(4 reviews),47.3568679,8.572198903,13.219352335350573,2,4
34,1732027456-40,https://www.hotels-zurich.com/search/?sort=Rating&order=DESC&part=1&Name=8,Le Bijou Lq80 Jacuzzi Penthouse,"80 Limmatquai, Zurich, Switzerland",The spacious 188 m² Le Bijou Lq80 Jacuzzi Penthouse Apartment is about 5 minutes by car from Polybahn and boasts spa facilities such as a hot tub. Limmat River is…,Acceptable,1022 CHF,(1 review),47.37337715,8.54309149,10.951144545350484,5,1
37,1732027458-43,https://www.hotels-zurich.com/search/?sort=Rating&order=DESC&part=1&Name=7,Hotel Schweizerhof Zuerich,"Bahnhofplatz 7, Zurich, Switzerland","Located in the heart of Zurich, Hotel Schweizerhof Zurich offers renovated rooms, just 0.6 km from Limmatquai Street. This superior hotel features both high-speed Internet access in the rooms…",Excellent,353 CHF,(1547 reviews),47.3769479,8.5394468,11.15061972535032,4,1547
38,1732027458-44,https://www.hotels-zurich.com/search/?sort=Rating&order=DESC&part=1&Name=7,Widder Hotel - Zurichs Luxury Hideaway,"Rennweg 7, Zurich, Switzerland","Located only a 12-minute walk from Swiss National Museum, the 5-star Widder Hotel - Zurichs Luxury Hideaway features a currency exchange and a lift. The traditional hotel lies in…",Excellent,583 CHF,(329 reviews),47.3724404,8.5398562,11.009227525350472,4,329
39,1732027458-45,https://www.hotels-zurich.com/search/?sort=Rating&order=DESC&part=1&Name=7,Townhouse Boutique Hotel,"Schuetzengasse 7, Zurich, Switzerland","Situated in the Old Town district of Zurich, the 3-star Townhouse Boutique Hotel gives access to entertainment venues like Urania Observatory, a mere 350 metres away. This Zurich hotel…",Excellent,244 CHF,(2041 reviews),47.376189,8.540024161,11.092279719350326,4,2041
42,1732027458-48,https://www.hotels-zurich.com/search/?sort=Rating&order=DESC&part=1&Name=7,Gasthaus Zum Guten Glueck,"Stationsstrasse 7, Zurich, Switzerland","Featuring Wi-Fi throughout the property, Gasthaus Zum Guten Gluck Zurich hotel sits within 25 minutes' walk of Lake Zurich.",Excellent,90 CHF,(1915 reviews),47.3727169,8.519837519,12.47898960535046,3,1915
43,1732027458-49,https://www.hotels-zurich.com/search/?sort=Rating&order=DESC&part=1&Name=7,Exclusive One Room Apartment Next To Zuerich Main Station,"7 Hafnerstrasse, Zurich, Switzerland","Located just 600 metres from Swiss National Historical Museum and Museum of Design, the 30 m² Exclusive One Room Apartment Next To Zurich Main features views of the city.",Excellent,318 CHF,(70 reviews),47.3807083,8.534444808,11.677875365350548,4,70
44,1732027458-50,https://www.hotels-zurich.com/search/?sort=Rating&order=DESC&part=1&Name=7,Many'S Historical City Central Apartments,"7 Beckenhofstrasse, Zurich, Switzerland","Many'S Historical City Central Apartments Zurich hotel is situated within 5 minutes' walk of the regenerated Platzspitz park and provides airport shuttle service, along with bicycles for rent. This…",Excellent,177 CHF,(33 reviews),47.3833324,8.541615953,11.42200028935045,4,33
45,1732027458-51,https://www.hotels-zurich.com/search/?sort=Rating&order=DESC&part=1&Name=7,Senioren-Residenz Segeten,"Carl-Spitteler-Strasse 70, Zurich, Switzerland","Offering a terrace and a garden, Senioren-Residenz Segeten hotel is situated in Zurich, 3 km from Parkanlage Zuerihorn. This aparthotel also provides Wi-Fi available throughout the property.",Excellent,270 CHF,(88 reviews),47.35537275,8.594163008,14.849501217350396,1,88
46,1732027458-52,https://www.hotels-zurich.com/search/?sort=Rating&order=DESC&part=1&Name=7,Wohnung Im Trendquartier Zentral - 24-7 Check-In With Keybox,"50 Turbinenstrasse, Zurich, Switzerland","Situated a 6-minute walk from Helsinki Live Music Venue, the spacious 1-bedroom Wohnung Im Trendquartier Zentral - 24-7 Check-In With Keybox offers proximity to various nearby tourist…",Excellent,153 CHF,(39 reviews),47.3867434,8.5140974,13.65569632535037,2,39
47,1732027461-53,https://www.hotels-zurich.com/search/?sort=Rating&order=DESC&part=1&Name=6,The Dolder Grand - City And Spa Resort Zurich,"Kurhausstrasse 65, Zurich, Switzerland","Offering cars for rent, The Dolder Grand - City And Spa Resort Zurich is around a 25-minute walk from Bahnhofstrasse. Guests can relax in an indoor pool or benefit from…",Excellent,569 CHF,(556 reviews),47.37276845,8.573080642,12.600645065350498,3,556
48,1732027461-54,https://www.hotels-zurich.com/search/?sort=Rating&order=DESC&part=1&Name=6,Ibis Styles Zurich City Center,"Stampfenbachstrasse 60, Zurich, Switzerland",The welcoming 3-star Ibis Styles Zurich City Center hotel is merely 500 metres from Swiss National Museum and features a cash machine and a lift. The designer hotel is…,Good,158 CHF,(7807 reviews),47.38124125,8.542624527,11.28953661735057,4,7807
49,1732027461-55,https://www.hotels-zurich.com/search/?sort=Rating&order=DESC&part=1&Name=6,Motel One Zuerich,"Stockerstrasse 61, Zurich, Switzerland","Nestled in the Old Town district of Zurich, the 3-star Motel One Zurich is just 1.5 km from such cultural places of interest as Zurich Opera House. The motel…",Excellent,182 CHF,(9769 reviews),47.36930115,8.533735615,11.441687515350502,4,9769
50,1732027461-56,https://www.hotels-zurich.com/search/?sort=Rating&order=DESC&part=1&Name=6,Small Luxury Hotel Ambassador Zurich,"Falkenstrasse 6, Zurich, Switzerland","Featuring a bureau de change and a lift, Small Luxury Hotel Ambassador Zurich is 16 minutes on foot from Lindenhof hill. This 4-star hotel features cars for rent, as…",Excellent,383 CHF,(520 reviews),47.3643402,8.547007943,11.275451587350378,4,520
51,1732027461-57,https://www.hotels-zurich.com/search/?sort=Rating&order=DESC&part=1&Name=6,Boutique Hotel Seefeld,"Seefeldstrasse 63, Zurich, Switzerland","Featuring a fitness centre and a courtyard, Sorell Hotel Seefeld is located right in the centre of Zurich, around a 20-minute walk from Lindenhof hill. This perfect hotel offers…",Excellent,238 CHF,(2037 reviews),47.3616254,8.551378302,11.631093229350329,4,2037
52,1732027461-58,https://www.hotels-zurich.com/search/?sort=Rating&order=DESC&part=1&Name=6,Hotel St. Josef,"Hirschengraben 64/68, Zurich, Switzerland","Providing 45 rooms, the 3-star Hotel St. Josef Zurich is situated at a distance of 0.8 km from Limmat. Wi-Fi is featured throughout the property and a currency…",Excellent,183 CHF,(2019 reviews),47.3709427,8.547061249,11.028263391350444,4,2019
53,1732027461-59,https://www.hotels-zurich.com/search/?sort=Rating&order=DESC&part=1&Name=6,Hotel Gregory,"Schoeneggstrasse 6, Zurich, Switzerland","Situated nearly a 20-minute walk from Beyer Clock and Watch Museum, the 2-star Hotel Gregory Zurich features Wi-Fi throughout the property, and public parking on site. This…",Good,85 CHF,(1301 reviews),47.3799829,8.5273266,12.1648603253505,3,1301
54,1732027461-60,https://www.hotels-zurich.com/search/?sort=Rating&order=DESC&part=1&Name=6,The Henry Self Check-In Guesthouse,"Heinrichstrasse 68, Zurich, Ch, Zurich, Switzerland","Located right in the centre of Zurich, the 3-star The Henry Self Check-In Guesthouse lies within reach of family attractions like Zoo Zurich, 3.4 km away. This smoke…",Good,163 CHF,(3431 reviews),47.3841924,8.530784132,12.155192157350566,3,3431
55,1732027461-61,https://www.hotels-zurich.com/search/?sort=Rating&order=DESC&part=1&Name=6,Aparthotel Adagio Zurich City Center,"Stampfenbachstrasse 60, Zurich, Switzerland","Offering a restaurant and luggage storage, the 4-star Aparthotel Adagio Zurich City Center lies in the Unterstrass district, within a 10-minute drive of Zoo Zurich and a mere…",Good,196 CHF,(2624 reviews),47.38124125,8.542624527,11.28953661735057,4,2624
56,1732027461-62,https://www.hotels-zurich.com/search/?sort=Rating&order=DESC&part=1&Name=6,Residence Mutschellen,"Mutschellenstrasse 6, Zurich, Ch, Zurich, Switzerland","Residence Mutschellen is situated at a 350-metre distance from Sherly's Kitchen and 15 km from Kloten airport. 2.5 km from St. Peter Church, this apartment welcomes guests with a…",Good,135 CHF,(1267 reviews),47.35429435,8.526745003,12.777641597350136,3,1267
57,1732027461-63,https://www.hotels-zurich.com/search/?sort=Rating&order=DESC&part=1&Name=6,Stay2Night City Center Hostel,"60 Kernstrasse, Zurich, Switzerland","Situated around a 5-minute stroll from Europaallee Street, Stay2Night City Center Hostel offers a terrace for guests to unwind. Offering baggage storage, the hostel is a 5-minute ride…",Average,35 CHF,(1256 reviews),47.3780014,8.5261636,12.141647525350525,3,1256
58,1732027461-64,https://www.hotels-zurich.com/search/?sort=Rating&order=DESC&part=1&Name=6,Self Service Hotel Kernhof Langstrasse,"Kernstrasse 67, Zurich, Switzerland","Offering location 5 minutes' walk from Drugstore Zurich GmbH, Self Service Hotel Kernhof Langstrasse Zurich offers 13 rooms. This hotel also includes a car park.",Good,161 CHF,(1353 reviews),47.378537,8.5265179,12.141829525350513,3,1353
59,1732027461-65,https://www.hotels-zurich.com/search/?sort=Rating&order=DESC&part=1&Name=6,The Yard Zuerich,"Baeckerstrasse 62, Zurich, Switzerland",The Yard Zurich Hotel is a 16-minute walk from Lindenhof hill and features a cash machine and a lift. The boutique hotel is in Aussersihl with a number of…,Good,171 CHF,(734 reviews),47.3758989,8.5276621,11.944817925350469,4,734
60,1732027461-66,https://www.hotels-zurich.com/search/?sort=Rating&order=DESC&part=1&Name=6,Signau House & Garden Boutique Hotel Zuerich,"6 Signaustrasse, Zurich, Switzerland","Situated an 18-minute walk from Chinese Garden Zurich, the 4-star Signau House & Garden Boutique Hotel Zurich offers meeting rooms with a range of business amenities. This Zurich hotel…",Excellent,332 CHF,(232 reviews),47.36274745,8.556171285,11.834005485350351,4,232
62,1732027461-68,https://www.hotels-zurich.com/search/?sort=Rating&order=DESC&part=1&Name=6,Swiss Star Zurich Oerlikon - Self Check-In,"Gubelstrasse 64, Zurich, Switzerland","Situated within 5 minutes' walk of SBB Ce 6/8 II Krokodil, Swiss Star Zurich Oerlikon - Self Check-In Apartment offers proximity to various nearby tourist attractions. This apartment features…",Good,139 CHF,(376 reviews),47.4094474,8.5408316,13.465914725350189,2,376
63,1732027461-69,https://www.hotels-zurich.com/search/?sort=Rating&order=DESC&part=1&Name=6,Hausteil In Einer Waldlichtung Im Stadtwald,"61 Fuchspass, Zurich, Switzerland",The spacious 75 m² Hausteil In Einer Waldlichtung Im Stadtwald offers views of the garden and a location 3.9 km from Volkshaus Zurich. The 1-bedroom apartment may also organise…,Excellent,273 CHF,(16 reviews),47.40601295,8.519485045,14.71697192535022,1,16
64,1732027461-70,https://www.hotels-zurich.com/search/?sort=Rating&order=DESC&part=1&Name=6,City Flat,"Zaehringerplatz, 8001 Zuerich, Zurich, Switzerland",City Flat Apartment is located about a 15-minute walk from Swiss National Museum and about a 25-minute walk from Flussbad Oberer Letten Outdoor Swimming Pool. This apartment offers…,Excellent,402 CHF,(1 review),47.3735316,8.544989862,10.979927585350396,5,1
65,1732027463-71,https://www.hotels-zurich.com/search/?sort=Rating&order=DESC&part=1&Name=5,Opera Hotel Zuerich,"Dufourstrasse 5, Zurich, Switzerland","The 4-star Opera Hotel Zurich is situated just a 5-minute walk from Bellevue Square and provides shuttle service, along with cars for rent. This Zurich hotel is in…",Good,233 CHF,(2369 reviews),47.3463188,8.566172801,13.49111879535051,2,2369
66,1732027463-72,https://www.hotels-zurich.com/search/?sort=Rating&order=DESC&part=1&Name=5,Ibis Zuerich Messe Airport,"Heidi Abel-Weg 5, Zurich, Switzerland","Situated a 10-minute walk from Glatt, the 3-star Ibis Zurich Messe Airport Hotel includes 252 rooms. The hotel also offers a cash machine and a bureau de change…",Good,113 CHF,(4919 reviews),47.41599765,8.558669467,14.700909977350513,1,4919
67,1732027463-73,https://www.hotels-zurich.com/search/?sort=Rating&order=DESC&part=1&Name=5,H+ Hotel Zuerich,"Badenerstrasse 537, Zurich, Switzerland","Featuring a bureau de change and a lift, H+ Hotel Zurich is situated approximately a 20-minute walk from the leading Swiss Industrial Design Museum. Featuring a barber shop and…",Excellent,153 CHF,(6451 reviews),47.38237345,8.500725511,14.657279825350528,1,6451
68,1732027463-74,https://www.hotels-zurich.com/search/?sort=Rating&order=DESC&part=1&Name=5,Fred Hotel Zuerich Hauptbahnhof,"Limmatstrasse 5, Zurich, Switzerland","Located close to a river, the 3-star Fred Hotel Zurich Hauptbahnhof is also near the entertainment district of Zurich. Boasting setting in the centre of Zurich, this pet-friendly…",Excellent,170 CHF,(847 reviews),47.380197,8.537286048,11.449911253350557,4,847
69,1732027463-75,https://www.hotels-zurich.com/search/?sort=Rating&order=DESC&part=1&Name=5,Zueri By Fassbind,"Heinrichstrasse 254, Zurich, Switzerland",The 4-star Zuri By Fassbind Hotel Zurich is only 6 minutes' walk from Markthalle and provides bright rooms at a distance of 0.6 km from Limmat. The pet-friendly…,Good,111 CHF,(3582 reviews),47.3894203,8.522041534,13.191561005350264,2,3582
70,1732027463-76,https://www.hotels-zurich.com/search/?sort=Rating&order=DESC&part=1&Name=5,Greulich Design & Boutique Hotel,"Herman-Greulich-Strasse 56, Zurich, Switzerland","Located approximately 25 minutes on foot from Old Town, the 3-star Greulich Design & Boutique Hotel Zurich offers a bureau de change and a lift. This Zurich hotel is in…",Excellent,198 CHF,(341 reviews),47.3786118,8.5205159,12.61718912535056,3,341
71,1732027463-77,https://www.hotels-zurich.com/search/?sort=Rating&order=DESC&part=1&Name=5,Fred Guest House Zuerich Hauptbahnhof,"Limmatstr.5, Zurich, Switzerland",The 2-star Fred Guest House Zurich Hauptbahnhof is situated right in the centre of Zurich merely 1.5 km from such shopping venues as Paradeplatz. The guest house also has…,Excellent,135 CHF,(832 reviews),47.380197,8.537286048,11.449911253350557,4,832
