web-scraper-order,web-scraper-start-url,name,address,description,review_cat,price,no_reviews,Latitude,Longitude
1732027470-139,https://www.hotels-zurich.com/search/?sort=Rating&order=DESC&part=1&Name=2,Green Marmot Capsule Hotel Zuerich,"26 Schifflaende, Zurich, Switzerland","Featuring a lift, a snack and drink vending machine, the 2-star Green Marmot Capsule Hotel Zurich hostel is located about 5 minutes' walk from the prominent 13th - century Gothic…",Good,55 CHF,(5922 reviews),47.3690605,8.544271687
1732027470-140,https://www.hotels-zurich.com/search/?sort=Rating&order=DESC&part=1&Name=2,Hotel Alden Spluegenschloss Zuerich - Leonardo Limited Edition,"Spluegenstrasse 2, Zurich, Switzerland","Featuring recreational facilities and a library, the 5-star Alden Suite Hotel Splugenschloss Zurich is situated close to the old district of Zurich. Quietly located around 500 metres from…",Excellent,452 CHF,(689 reviews),47.3646019,8.5342315
1732027470-141,https://www.hotels-zurich.com/search/?sort=Rating&order=DESC&part=1&Name=2,Zueri By Fassbind,"Heinrichstrasse 254, Zurich, Switzerland",The 4-star Zuri By Fassbind Hotel Zurich is only 6 minutes' walk from Markthalle and provides bright rooms at a distance of 0.6 km from Limmat. The pet-friendly…,Good,111 CHF,(3582 reviews),47.3894203,8.522041534
1732027470-142,https://www.hotels-zurich.com/search/?sort=Rating&order=DESC&part=1&Name=2,Best Western Plus Hotel Zuercherhof,"Zaehringerstrasse 21, Zurich, Switzerland","The 3-star Best Western Plus Hotel Zurcherhof Zurich is located near a shopping district, approximately 5 minutes by car from Zurich Toy Museum. This designer hotel is situated a…",Excellent,235 CHF,(2934 reviews),47.3749804,8.5445108
1732027470-143,https://www.hotels-zurich.com/search/?sort=Rating&order=DESC&part=1&Name=2,Design Hotel Plattenhof,"Plattenstrasse 26, Zurich, Switzerland","The stylish Design Hotel Plattenhof Zurich is situated close to a university district, at a distance of 2.5 km from Chinese Garden Zurich. Boasting views of the garden, along with…",Good,213 CHF,(1178 reviews),47.37378085,8.553168391
1732027470-144,https://www.hotels-zurich.com/search/?sort=Rating&order=DESC&part=1&Name=2,Gasthaus 210,"Langstrasse 210, Zurich, Switzerland","About a 5-minute drive from Fraumunster Church, the 3-star Gasthaus 210 Hotel Zurich offers a bureau de change and a cash machine. 19 rooms and the snack bar…",Good,135 CHF,(2428 reviews),47.38285635,8.530221822
1732027470-145,https://www.hotels-zurich.com/search/?sort=Rating&order=DESC&part=1&Name=2,Josephine'S Guesthouse - ! Women Only !,"Lutherstrasse 20, Zurich, Ch, Zurich, Switzerland","Situated in Aussersihl with a number of second-hand stores and markets selling food and handicrafts, merely 1.1 km from Lindenhof hill, the 2-star Josephine'S Guesthouse - ! Women Only ! Zurich…",Excellent,130 CHF,(1748 reviews),47.3743152,8.5290412
1732027470-146,https://www.hotels-zurich.com/search/?sort=Rating&order=DESC&part=1&Name=2,Swiss Star Longstreet - Self Check-In,"Langstrasse 213, Zurich, Switzerland","Located a mere 550 metres from Niederdorf and Gonzo, Swiss Star Longstreet - Self Check-In Apartment features views of the city. Guests can use Wi-Fi for either business or…",Average,135 CHF,(1290 reviews),47.38314345,8.530109171
1732027470-147,https://www.hotels-zurich.com/search/?sort=Rating&order=DESC&part=1&Name=2,Guest House Hermes Contactless Self Checkin,"Limmattalstrasse 211, Zurich, Switzerland",Guest House Hermes Contactless Self Checkin Zurich has 11 rooms and is located at a distance of 4.7 km from the modern FIFA World Football Museum. The hotel features Wi…,Good,81 CHF,(1010 reviews),47.39895832,8.505407775
1732027470-148,https://www.hotels-zurich.com/search/?sort=Rating&order=DESC&part=1&Name=2,Le Bijou Lintheschergasse / Zurich Hb,"Lintheschergasse 23, Zurich, Switzerland","Nestled in the Old Town district, Le Bijou Lintheschergasse / Zurich Hb is 2.1 km from such cultural places of interest as Migros Museum of Contemporary Art. The apartment assures guests'…",Excellent,558 CHF,(154 reviews),47.37682725,8.538844702
1732027470-149,https://www.hotels-zurich.com/search/?sort=Rating&order=DESC&part=1&Name=2,Zuerich Niederdorf - Grossmuenster,"Muenstergasse 22, Zurich, Switzerland",Zurich Niederdorf - Grossmunster Apartment is located only a 6-minute walk from Beyer Clock and Watch Museum and looks out onto the city. Wi-Fi is available for guests' business…,Excellent,228 CHF,(74 reviews),47.37137475,8.544276719
1732027470-150,https://www.hotels-zurich.com/search/?sort=Rating&order=DESC&part=1&Name=2,Loewenplatz Apartment Near Station By Airhome,"Usteristrasse 23, Zurich, Switzerland","If you want to stay in the Old Town district, the 1-room Lowenplatz Apartment Near Station By Airhome is a good choice located, an 8-minute walk from Ethnographic…",Excellent,348 CHF,(45 reviews),47.3758299,8.536064503
1732027472-151,https://www.hotels-zurich.com/search/?sort=Rating&order=DESC&part=1&Name=1,Baur Au Lac,"Talstrasse 1, Zurich, Switzerland","Nestled in a shopping area, the 5-star Baur Au Lac hotel overlooks Lake Zurich and offers a bureau de change and a lift. Located in a private park and…",Excellent,685 CHF,(629 reviews),47.3671121,8.5393433
1732027472-152,https://www.hotels-zurich.com/search/?sort=Rating&order=DESC&part=1&Name=1,Hotel Adler Zuerich,"Rosengasse 10, Zurich, Switzerland","Offering a restaurant and a storage room, the charming Hotel Adler Zurich lies in the Old Town district, just 600 metres from the compact Zurich Toy Museum and at a…",Excellent,207 CHF,(2166 reviews),47.37310225,8.543490983
1732027472-153,https://www.hotels-zurich.com/search/?sort=Rating&order=DESC&part=1&Name=1,Central Plaza,"Central 1, Zurich, Switzerland","The welcoming 4-star Central Plaza Zurich hotel, located only 400 metres from Limmatquai Street, features a fitness centre, a health club, and a terrace. The luxury hotel offers 103…",Excellent,250 CHF,(3087 reviews),47.37719435,8.543623596
1732027472-154,https://www.hotels-zurich.com/search/?sort=Rating&order=DESC&part=1&Name=1,Sheraton Zuerich Hotel,"Pfingstweidstrasse 100, Zurich, Switzerland","The 4-star Sheraton Zurich Hotel is located in the heart of Zurich and features Wi-Fi in public areas, along with public parking on site. There is a train…",Good,283 CHF,(1013 reviews),47.3907286,8.5101238
1732027472-155,https://www.hotels-zurich.com/search/?sort=Rating&order=DESC&part=1&Name=1,Boutique Hotel Wellenberg,"Niederdorfstrasse 10, Zurich, Switzerland","Boutique Hotel Wellenberg Zurich is located in the Old Town district, approximately a 5-minute walk from Limmat. The hotel features a safe deposit box and 24-hour security service…",Excellent,263 CHF,(3228 reviews),47.3729812,8.543859
1732027472-156,https://www.hotels-zurich.com/search/?sort=Rating&order=DESC&part=1&Name=1,B2 Hotel Zuerich,"Brandschenkestrasse 152, Zurich, Switzerland","B2 Hotel Zurich, located approximately a 5-minute ride from FIFA World Football Museum and about 25 minutes on foot from the towered Romanesque cathedral ""Grossmunster"", features a rooftop pool…",Excellent,383 CHF,(1213 reviews),47.36459075,8.524402595
1732027472-157,https://www.hotels-zurich.com/search/?sort=Rating&order=DESC&part=1&Name=1,Zurich Youth Hostel,"Mutschellenstrasse 114A, Zurich, Switzerland","Offering 421 rooms, the 2-star Zurich Youth Hostel boasts a location within 5 minutes' walk of Lake promenade. Located within 25 minutes' walk of Sechselautenplatz, this hostel offers guests…",Excellent,61 CHF,(4093 reviews),47.35028791,8.527832697
1732027472-158,https://www.hotels-zurich.com/search/?sort=Rating&order=DESC&part=1&Name=1,Marktgasse Hotel,"Marktgasse 17, Zurich, Switzerland",Marktgasse Hotel Zurich offers a terrace and various recreational opportunities and sits only 6 minutes' walk from Circus Conelli. The hotel also provides Wi-Fi available throughout the property.,Excellent,163 CHF,(1472 reviews),47.3720247,8.54355218
1732027472-159,https://www.hotels-zurich.com/search/?sort=Rating&order=DESC&part=1&Name=1,25Hours Hotel Langstrasse,"Langstrasse 150, Zurich, Switzerland","Located approximately a 20-minute stroll from Old Botanical Garden, the comfortable 4-star 25Hours Hotel Langstrasse Zurich offers amenities such as a fitness centre and a sundeck. This Zurich…",Excellent,224 CHF,(2634 reviews),47.3804842,8.5285344
1732027472-160,https://www.hotels-zurich.com/search/?sort=Rating&order=DESC&part=1&Name=1,Novotel Zurich City West,"Schiffbaustrasse 13, Zurich, Switzerland","Novotel Zurich City West hotel is located in Zurich, 10 minutes' drive away Bahnhofstrasse, and offers an indoor swimming pool. This hotel has 144 rooms and features a snack and…",Good,219 CHF,(697 reviews),47.3891828,8.5167794
1732027472-161,https://www.hotels-zurich.com/search/?sort=Rating&order=DESC&part=1&Name=1,Hotel Scheuble,"Muehlegasse 17, Zurich, Switzerland","Hotel Scheuble Zurich is only a short walk from Zentralbibliothek, and features a bureau de change and a lift onsite. The hotel provides a private parking garage for CHF 30…",Excellent,159 CHF,(2926 reviews),47.3744223,8.5449496
1732027472-162,https://www.hotels-zurich.com/search/?sort=Rating&order=DESC&part=1&Name=1,"Neues Schloss Privat Hotel Zurich, Autograph Collection","Stockerstrasse 17, Zurich, Switzerland","Nestled in the immediate vicinity of a lake, the 5-star Neues Schloss Privat Hotel Zurich, Autograph Collection features a sundeck and various recreational opportunities. The smoke-free hotel is…",Excellent,384 CHF,(187 reviews),47.3654755,8.535915473
1732027472-163,https://www.hotels-zurich.com/search/?sort=Rating&order=DESC&part=1&Name=1,Hotel Krone Unterstrass,"Schaffhauserstrasse 1, Zurich, Switzerland",The comfortable 4-star Hotel Krone Unterstrass Zurich is merely an 8-minute walk from Flussbad Oberer Letten Outdoor Swimming Pool and offers a currency exchange and a cash machine.,Excellent,193 CHF,(3808 reviews),47.38804085,8.539007831
1732027472-164,https://www.hotels-zurich.com/search/?sort=Rating&order=DESC&part=1&Name=1,Courtyard By Marriott Zurich North,"Max-Bill-Platz 19, Zurich, Switzerland","Offering 152 rooms, the comfortable Courtyard By Marriott Zurich North Hotel is close to a business district and at a distance of 6 km from Lake Zurich. Highlights at this…",Good,225 CHF,(1090 reviews),47.41431955,8.541077866
1732027472-165,https://www.hotels-zurich.com/search/?sort=Rating&order=DESC&part=1&Name=1,Hotel Kindli,"Pfalzgasse 1, Zurich, Switzerland","The 3-star Hotel Kindli Zurich is located just a few steps from a financial district, at a distance of 1 km from Kongresshaus Zurich Convention Center. Featuring 20 rooms…",Excellent,309 CHF,(325 reviews),47.3724267,8.5406434
1732027472-166,https://www.hotels-zurich.com/search/?sort=Rating&order=DESC&part=1&Name=1,Hotel Limmathof,"Limmatquai 142, Zurich, Switzerland",Hotel Limmathof Zurich is around a 5-minute walk from Limmat and provides guests with a lift and a vending machine. This 2-star hotel features Wi-Fi in the…,Good,140 CHF,(962 reviews),47.3764427,8.544159773
1732027472-167,https://www.hotels-zurich.com/search/?sort=Rating&order=DESC&part=1&Name=1,Saint Georges Hotel,"Weberstrasse 11, Zurich, Switzerland","Located 15 km from Kloten airport, the 2-star Saint Georges Hotel Zurich features airport transfer service and car rentals for guests to take advantage of. The smoke-free hotel…",Excellent,114 CHF,(1894 reviews),47.37072945,8.528125829
1732027472-168,https://www.hotels-zurich.com/search/?sort=Rating&order=DESC&part=1&Name=1,Sorell Hotel St. Peter,"In Gassen 10, Zurich, Switzerland","Located within 5 minutes' walk of the Romanesque-style Protestant church ""Grossmunster"", the 4-star Sorell Hotel St. Peter Zurich offers fitness classes, a terrace, and a shared lounge. This…",Excellent,268 CHF,(1446 reviews),47.37085145,8.540517702
1732027472-169,https://www.hotels-zurich.com/search/?sort=Rating&order=DESC&part=1&Name=1,Ibis Zuerich City West,"Schiffbaustrasse 11, Zurich, Switzerland","A 10-minute drive from Old Town, the 3-star Ibis Zurich City West hotel offers a lift, a snack and drink vending machine. This Zurich hotel also includes a…",Good,143 CHF,(2135 reviews),47.3890558,8.5171575
1732027472-170,https://www.hotels-zurich.com/search/?sort=Rating&order=DESC&part=1&Name=1,Trip Inn Zurich Hotel,"Hohlstrasse 18, Zurich, Switzerland","Offering a Chinese garden, Trip Inn Zurich Hotel welcomes guests in the heart of Zurich, 3.4 km from Zoo Zurich. The hotel also provides Wi-Fi available throughout the property.",Good,109 CHF,(3721 reviews),47.3770674,8.5277016