web-scraper-order,web-scraper-start-url,name,address,description,review_cat,price,no_reviews,Latitude,Longitude
1732027463-72,https://www.hotels-zurich.com/search/?sort=Rating&order=DESC&part=1&Name=5,Ibis Zuerich Messe Airport,"Heidi Abel-Weg 5, Zurich, Switzerland","Situated a 10-minute walk from Glatt, the 3-star Ibis Zurich Messe Airport Hotel includes 252 rooms. The hotel also offers a cash machine and a bureau de change…",Good,113 CHF,(4919 reviews),47.41599765,8.558669467
1732027463-73,https://www.hotels-zurich.com/search/?sort=Rating&order=DESC&part=1&Name=5,H+ Hotel Zuerich,"Badenerstrasse 537, Zurich, Switzerland","Featuring a bureau de change and a lift, H+ Hotel Zurich is situated approximately a 20-minute walk from the leading Swiss Industrial Design Museum. Featuring a barber shop and…",Excellent,153 CHF,(6451 reviews),47.38237345,8.500725511
1732027463-74,https://www.hotels-zurich.com/search/?sort=Rating&order=DESC&part=1&Name=5,Fred Hotel Zuerich Hauptbahnhof,"Limmatstrasse 5, Zurich, Switzerland","Located close to a river, the 3-star Fred Hotel Zurich Hauptbahnhof is also near the entertainment district of Zurich. Boasting setting in the centre of Zurich, this pet-friendly…",Excellent,170 CHF,(847 reviews),47.380197,8.537286048
1732027463-75,https://www.hotels-zurich.com/search/?sort=Rating&order=DESC&part=1&Name=5,Zueri By Fassbind,"Heinrichstrasse 254, Zurich, Switzerland",The 4-star Zuri By Fassbind Hotel Zurich is only 6 minutes' walk from Markthalle and provides bright rooms at a distance of 0.6 km from Limmat. The pet-friendly…,Good,111 CHF,(3582 reviews),47.3894203,8.522041534
1732027463-76,https://www.hotels-zurich.com/search/?sort=Rating&order=DESC&part=1&Name=5,Greulich Design & Boutique Hotel,"Herman-Greulich-Strasse 56, Zurich, Switzerland","Located approximately 25 minutes on foot from Old Town, the 3-star Greulich Design & Boutique Hotel Zurich offers a bureau de change and a lift. This Zurich hotel is in…",Excellent,198 CHF,(341 reviews),47.3786118,8.5205159
1732027463-77,https://www.hotels-zurich.com/search/?sort=Rating&order=DESC&part=1&Name=5,Fred Guest House Zuerich Hauptbahnhof,"Limmatstr.5, Zurich, Switzerland",The 2-star Fred Guest House Zurich Hauptbahnhof is situated right in the centre of Zurich merely 1.5 km from such shopping venues as Paradeplatz. The guest house also has…,Excellent,135 CHF,(832 reviews),47.380197,8.537286048
1732027463-78,https://www.hotels-zurich.com/search/?sort=Rating&order=DESC&part=1&Name=5,Boutique Hotel Kronenhof,"Wehntalerstrasse 551, Zurich, Switzerland","Featuring a cash machine and a lift, Hotel Kronenhof Zurich sits at a distance of 3.6 km from Migros Museum of Contemporary Art. This 3-star hotel features both Wi…",Good,129 CHF,(1053 reviews),47.41906605,8.505371563
1732027463-79,https://www.hotels-zurich.com/search/?sort=Rating&order=DESC&part=1&Name=5,Best Western Hotel Spirgarten,"Lindenplatz 5, Zurich, Switzerland","Offering a convenience shop and a restaurant, Best Western Hotel Spirgarten Zurich lies in the Altstetten district, around 10 minutes by car from Grossmunster and around 10 minutes by car…",Good,151 CHF,(1344 reviews),47.3874412,8.4853017
1732027463-80,https://www.hotels-zurich.com/search/?sort=Rating&order=DESC&part=1&Name=5,Aparthotel Familie Hugenschmidt,"Karlstrasse 5, Zurich, Switzerland","Situated 700 metres from Botanical Garden of the University of Zurich, the 2-star Aparthotel Familie Hugenschmidt Zurich includes 13 rooms with views of the garden. This refined hotel provides…",Excellent,163 CHF,(376 reviews),47.35543855,8.5572725
1732027463-81,https://www.hotels-zurich.com/search/?sort=Rating&order=DESC&part=1&Name=5,5-Mins Walk To Zurich Main Station - City Center,"Graebligasse 4, Zurich, Switzerland",The 1-room 5-Mins Walk To Zurich Main Station - City Center is also located within a 500-metre distance of Limmatquai Street. Situated within walking distance of Zurich Christmas…,Good,241 CHF,(15 reviews),47.3755279,8.5442599
1732027463-82,https://www.hotels-zurich.com/search/?sort=Rating&order=DESC&part=1&Name=5,Wohnung Im Trendquartier Zentral - 24-7 Check-In With Keybox,"50 Turbinenstrasse, Zurich, Switzerland","Situated a 6-minute walk from Helsinki Live Music Venue, the spacious 1-bedroom Wohnung Im Trendquartier Zentral - 24-7 Check-In With Keybox offers proximity to various nearby tourist…",Excellent,153 CHF,(39 reviews),47.3867434,8.5140974
1732027463-83,https://www.hotels-zurich.com/search/?sort=Rating&order=DESC&part=1&Name=5,Historisches Chalet Im Herzen Von Zuerich,"56 Niederdorfstrasse, Zurich, Switzerland","Located just 1.1 km from Holmes Place, the 1-room Historisches Chalet Im Herzen Von Zurich features parking for those who travel by car. Zurich Opera House can be reached…",Excellent,255 CHF,(4 reviews),47.3752327,8.544066895
1732027463-84,https://www.hotels-zurich.com/search/?sort=Rating&order=DESC&part=1&Name=5,"Downtown Dream 3,5Br With Balcony And Style Ba42","Baumackerstrasse 58, Zurich, Switzerland","Set within 20 minutes' walk of Leutschenpark, the spacious 1-bedroom Downtown Dream 3,5Br With Balcony And Style Ba42 Apartment comprises a balcony and a dining place overlooking the…",Good,478 CHF,(8 reviews),47.40994535,8.541602371
1732027463-85,https://www.hotels-zurich.com/search/?sort=Rating&order=DESC&part=1&Name=5,Aparthotel Splendid City Center,"5 Rosengasse, Zurich, Switzerland","Located nearly 5 minutes' walk from Limmat River, Aparthotel Splendid City Center is only 450 metres from Grossmunster.",Good,403 CHF,(19 reviews),47.3732682,8.543263973
1732027463-86,https://www.hotels-zurich.com/search/?sort=Rating&order=DESC&part=1&Name=5,Ground Floor Apartment - Peaceful Living In The City Of Zuerich,"51 Rieterstrasse, Zurich, Switzerland",Spacious 1-bedroom Ground Floor Apartment - Peaceful Living In The City Of Zurich offers views of the garden and a location a 10-minute ride from Old Town. Wi-Fi…,Excellent,335 CHF,(9 reviews),47.35726395,8.52634845
1732027463-87,https://www.hotels-zurich.com/search/?sort=Rating&order=DESC&part=1&Name=5,Superior Studio On Top Floor Be-51,"Bertastrasse 15, Zurich, Switzerland","The 22 m² Superior Studio On Top Floor Be-51, located in the Wiedikon district, around a 10-minute ride from Zurich Opera House, features views of the city. Public…",Excellent,218 CHF,(1 review),47.37500035,8.515815823
1732027463-88,https://www.hotels-zurich.com/search/?sort=Rating&order=DESC&part=1&Name=5,"Downtown Dream 3,5Br With Balcony And Style Ba22","Baumackerstrasse 58, Zurich, Switzerland","Situated about 6 km from Lake Zurich, the spacious 75 m² Downtown Dream 3,5Br With Balcony And Style Ba22 Apartment provides guests with Wi-Fi for either business or…",Average,470 CHF,(7 reviews),47.40994535,8.541602371
1732027463-89,https://www.hotels-zurich.com/search/?sort=Rating&order=DESC&part=1&Name=5,Urban Oasis With Queen Bed And View Be-53,"Bertastrasse 15, Zurich, Switzerland",The 14 m² Urban Oasis With Queen Bed And View Be-53 is located 20 minutes' walk from Migros Museum of Contemporary Art and offers Wi-Fi for either business…,Good,211 CHF,(2 reviews),47.37500035,8.515815823
1732027463-90,https://www.hotels-zurich.com/search/?sort=Rating&order=DESC&part=1&Name=5,Downtown Deluxe Studio With Queen Bed Be-55,"Bertastrasse 15, Zurich, Switzerland","The 1-room Downtown Deluxe Studio With Queen Bed Be-55 lies in the Wiedikon district and provides guests with Wi-Fi, and public parking nearby. Limmat River is within…",Average,209 CHF,(5 reviews),47.37500035,8.515815823
1732027465-91,https://www.hotels-zurich.com/search/?sort=Rating&order=DESC&part=1&Name=4,Zurich Marriott Hotel,"Neumuehlequai 42, Zurich, Switzerland",The 5-star Zurich Marriott Hotel is situated an 8-minute walk from Swiss National Historical Museum and features a cash machine and a currency exchange. Featuring a storage room…,Good,342 CHF,(1486 reviews),47.38241495,8.540556177
1732027465-92,https://www.hotels-zurich.com/search/?sort=Rating&order=DESC&part=1&Name=4,Ruby Mimi Hotel Zurich,"4 Beatenpl., Zurich, Ch, Zurich, Switzerland","Located around 300 metres from a popular entertainment attraction like Urania Observatory, the 3-star Ruby Mimi Hotel Zurich offers modern comforts like a lift, a snack and drink vending…",Excellent,244 CHF,(7683 reviews),47.3761676,8.54138
1732027465-93,https://www.hotels-zurich.com/search/?sort=Rating&order=DESC&part=1&Name=4,Citizenm Zuerich,"Talacker 42, Zurich, Switzerland","Located in a business neighbourhood and nearly 5 minutes' walk from Beyer Clock and Watch Museum, the perfect Citizenm Zurich Hotel features a shared lounge and a lending library. Highlights…",Excellent,222 CHF,(3516 reviews),47.3720407,8.535359095
1732027465-94,https://www.hotels-zurich.com/search/?sort=Rating&order=DESC&part=1&Name=4,Meininger Hotel Zuerich Greencity,"41 Maneggstrasse, Zurich, Switzerland","Meininger Hotel Zurich Greencity features a lift, a snack and drink vending machine, and lies 3.3 km from Lake Zurich. This hotel also provides Wi-Fi available throughout the property.",Good,48 CHF,(7200 reviews),47.34180215,8.520194284
1732027465-95,https://www.hotels-zurich.com/search/?sort=Rating&order=DESC&part=1&Name=4,Hotel Alexander Zurich Old Town,"Niederdorfstrasse 40, Zurich, Switzerland","Located a 15-minute walk from Zurich Opera House, the 3-star Hotel Alexander Zurich Old Town offers modern comforts such as a currency exchange and a lift. Private car…",Excellent,187 CHF,(1827 reviews),47.37460085,8.543954645
1732027465-96,https://www.hotels-zurich.com/search/?sort=Rating&order=DESC&part=1&Name=4,La Reserve Eden Au Lac Zurich,"Utoquai 45, Zurich, Switzerland","Situated only 1 km from Museum of Art, the prestigious La Reserve Eden Au Lac Zurich hotel features Wi-Fi in public areas and a private parking lot on site.",Excellent,802 CHF,(443 reviews),47.36277355,8.547379701
1732027465-97,https://www.hotels-zurich.com/search/?sort=Rating&order=DESC&part=1&Name=4,Swiss Chocolate By Fassbind Zurich,"Zahringerstrasse 46, Zurich, Switzerland","Featuring a bureau de change and a lift, Swiss Chocolate By Fassbind Zurich Hotel is situated at a 900-metre distance from Helmhaus Gallery. The 3-star hotel features fitness…",Good,182 CHF,(2123 reviews),47.37541058,8.544594455
1732027465-98,https://www.hotels-zurich.com/search/?sort=Rating&order=DESC&part=1&Name=4,Sorell Hotel Ruetli,"Zaehringerstrasse 43, Zurich, Switzerland","The 3-star Sorell Hotel Rutli is situated in the Old Town district of Zurich, merely 14 minutes' walk from Circus Conelli, which is highly recommended for a family visit.",Excellent,207 CHF,(2424 reviews),47.3762011,8.5444271
1732027465-99,https://www.hotels-zurich.com/search/?sort=Rating&order=DESC&part=1&Name=4,Altstadt Hotel,"Kirchgasse 4, Zurich, Switzerland","The lovely 3-star Altstadt Hotel Zurich is situated around 5 minutes' walk from Paradeplatz and provides airport transfer service, along with cars for rent. Centrally located in the Old…",Excellent,185 CHF,(1651 reviews),47.3693317,8.544102772
1732027465-100,https://www.hotels-zurich.com/search/?sort=Rating&order=DESC&part=1&Name=4,Ameron Zuerich Bellerive Au Lac,"Utoquai 47, Zurich, Switzerland","Boasting a solarium and a golf course, the 4-star Ameron Zurich Bellerive Au Lac hotel lies a mere 7 minutes' walk from Sechselautenplatz. The hotel provides a bureau de…",Excellent,317 CHF,(1239 reviews),47.3625248,8.5480473
1732027465-101,https://www.hotels-zurich.com/search/?sort=Rating&order=DESC&part=1&Name=4,Hechtplatz Hotel,"4 Kruggasse, Zurich, Switzerland","The 3-star Hechtplatz Hotel - Self Check-In Zurich, situated at a 700-metre distance from Kongresshaus Zurich Convention Center, welcomes guests with a sun deck and karaoke. Located a…",Good,174 CHF,(1296 reviews),47.36816475,8.545297771
1732027465-102,https://www.hotels-zurich.com/search/?sort=Rating&order=DESC&part=1&Name=4,Amazing Rooms By Five,"Doeltschihalde 49, Zurich, Switzerland","The 4-star Amazing Rooms By Five hotel features a currency exchange and a lift and is located at a distance of 3.3 km from Fraumunster Church, one of the…",Good,341 CHF,(81 reviews),47.364227,8.496811639
1732027465-103,https://www.hotels-zurich.com/search/?sort=Rating&order=DESC&part=1&Name=4,5-Mins Walk To Zurich Main Station - City Center,"Graebligasse 4, Zurich, Switzerland",The 1-room 5-Mins Walk To Zurich Main Station - City Center is also located within a 500-metre distance of Limmatquai Street. Situated within walking distance of Zurich Christmas…,Good,241 CHF,(15 reviews),47.3755279,8.5442599
1732027465-104,https://www.hotels-zurich.com/search/?sort=Rating&order=DESC&part=1&Name=4,Urban Oasis With Queen Bed And View Be-49,"Bertastrasse 15, Zurich, Switzerland","Nestled in the Wiedikon district, the 1-room Urban Oasis With Queen Bed And View Be-49 features Wi-Fi and parking nearby. Kirche St. Jakob am Stauffacher Church is…",Good,213 CHF,(9 reviews),47.37500035,8.515815823
1732027465-105,https://www.hotels-zurich.com/search/?sort=Rating&order=DESC&part=1&Name=4,Urban Oasis With Queen Bed And View Be-42,"Bertastrasse 15, Zurich, Switzerland","Situated just 6 minutes' walk from Baeckeranlage, Urban Oasis With Queen Bed And View Be-42 looks out onto the city. Guests will enjoy Wi-Fi, and parking provided nearby.",Good,205 CHF,(7 reviews),47.37500035,8.515815823
1732027465-106,https://www.hotels-zurich.com/search/?sort=Rating&order=DESC&part=1&Name=4,Skyline Rooftop Suite With 2 Balconies -401-,"Friesstrasse 12, Zurich, Switzerland",The 1-room Skyline Rooftop Suite With 2 Balconies -401- offers a barber shop and a restaurant and lies at a distance of 3.4 km from a top family-friendly…,Excellent,479 CHF,(9 reviews),47.4143107,8.546906187
1732027465-107,https://www.hotels-zurich.com/search/?sort=Rating&order=DESC&part=1&Name=4,"Balcony Suite In Central Zurich Sh2,4R","Schaffhauserstrasse 210, Zurich, Switzerland","Situated a mere 450 metres from Anthropologisches Museum der Universitat Zurich, Balcony Suite In Central Zurich Sh2,4R looks out onto the city. This apartment offers a private parking lot…",Excellent,298 CHF,(10 reviews),47.40116235,8.545249869
1732027465-108,https://www.hotels-zurich.com/search/?sort=Rating&order=DESC&part=1&Name=4,Urban Oasis With Queen Bed And View Be-43,"Bertastrasse 15, Zurich, Switzerland","The 14 m² Urban Oasis With Queen Bed And View Be-43 is located in the Wiedikon district, 5 minutes' stroll from Don Bosco. This 1-bedroom apartment offers modern…",Good,209 CHF,(3 reviews),47.37500035,8.515815823
1732027465-109,https://www.hotels-zurich.com/search/?sort=Rating&order=DESC&part=1&Name=4,Urban Oasis With Queen Bed And View Be-48,"Bertastrasse 15, Zurich, Switzerland",The 12 m² Urban Oasis With Queen Bed And View Be-48 is situated within 500 metres of Baeckeranlage and 15 km from Kloten airport. The apartment has parking nearby.,Excellent,211 CHF,(5 reviews),47.37500035,8.515815823
1732027467-111,https://www.hotels-zurich.com/search/?sort=Rating&order=DESC&part=1&Name=3,Hotel Montana Zuerich,"Konradstrasse 39, Zurich, Switzerland",The 3-star Hotel Montana Zurich is around a 5-minute walk from Museum of Design and features car rentals for guests' convenience. This Zurich hotel is in Escher Wyss…,Good,208 CHF,(4769 reviews),47.3807803,8.535246536
1732027467-112,https://www.hotels-zurich.com/search/?sort=Rating&order=DESC&part=1&Name=3,Hotel Glockenhof Zuerich,"Sihlstrasse 31, Zurich, Switzerland","Hotel Glockenhof Zurich, located 17 minutes on foot from FIFA World Football Museum, features Wi-Fi throughout the property. This hotel provides private parking for CHF 39 per day on…",Excellent,326 CHF,(1325 reviews),47.3729614,8.5365218
1732027467-113,https://www.hotels-zurich.com/search/?sort=Rating&order=DESC&part=1&Name=3,Hotel Bristol Zurich,"Stampfenbachstrasse 34, Zurich, Switzerland","Situated a mere 14 minutes' walk from Helmhaus Gallery, Hotel Bristol Zurich features a bureau de change and a lift. This 3-star hotel provides guests with Wi-Fi throughout…",Good,134 CHF,(5618 reviews),47.3796483,8.543557
1732027467-114,https://www.hotels-zurich.com/search/?sort=Rating&order=DESC&part=1&Name=3,Hotel City Zuerich Design & Lifestyle,"Loewenstrasse 34, Zurich, Switzerland","Offering a bureau de change and a lift, Hotel City Zurich Design & Lifestyle is just a 7-minute walk from Lindenhof hill. This comfortable hotel also provides Wi-Fi available…",Excellent,200 CHF,(2382 reviews),47.374868,8.5364144
1732027467-115,https://www.hotels-zurich.com/search/?sort=Rating&order=DESC&part=1&Name=3,Hotel Marta,"Zaehringerstrasse 36, Zurich, Switzerland",The 2-star Hotel Marta Zurich is approximately a 5-minute walk from Limmat and provides guests with a bureau de change and a vending machine. The comfortable hotel features…,Excellent,136 CHF,(4012 reviews),47.37595955,8.544779481
1732027467-116,https://www.hotels-zurich.com/search/?sort=Rating&order=DESC&part=1&Name=3,Placid Hotel Design & Lifestyle Zurich,"Buckhauserstrasse 36, Zurich, Switzerland","Featuring views of Alps, Placid Hotel Design & Lifestyle Zurich is located in a business district. Staying at the hotel means that you'll receive excellent service, along with a currency exchange…",Excellent,159 CHF,(3110 reviews),47.3834624,8.492374549
1732027467-117,https://www.hotels-zurich.com/search/?sort=Rating&order=DESC&part=1&Name=3,Hotel Stoller,"Badenerstrasse 357, Zurich, Switzerland","Overlooking Swiss Alps, the comfortable Hotel Stoller Zurich includes a terrace and various recreational opportunities. Centrally located in the Wiedikon district of Zurich an 8-minute walk from…",Excellent,119 CHF,(530 reviews),47.3784655,8.509293707
1732027467-118,https://www.hotels-zurich.com/search/?sort=Rating&order=DESC&part=1&Name=3,Glaernischhof By Trinity,"Claridenstrasse 30, Zurich, Switzerland","Offering a fitness centre, a sauna, and various recreational opportunities, the comfortable Glarnischhof By Trinity Hotel Zurich is nestled in Enge, which is a largely contemporary residential…",Excellent,309 CHF,(4979 reviews),47.3676837,8.537378103
1732027467-120,https://www.hotels-zurich.com/search/?sort=Rating&order=DESC&part=1&Name=3,Hotel Sternen Oerlikon,"Schaffhauserstrasse 335, Zurich, Switzerland","The superior 3-star Hotel Sternen Oerlikon Zurich, situated a mere 250 metres from Stahlbau VHP Sculpture, offers a shared lounge and various recreational opportunities. An à la carte restaurant…",Excellent,183 CHF,(1299 reviews),47.40840775,8.546416159
1732027467-121,https://www.hotels-zurich.com/search/?sort=Rating&order=DESC&part=1&Name=3,Olympia Hotel Zurich,"Badenerstrasse 324, Zurich, Switzerland","Featuring a cash machine and a bureau de change, Olympia Hotel Zurich is nestled in Zurich, nearly a 5-minute walk from Katholische Kirche Felix und Regula. This hotel entices…",Good,89 CHF,(3694 reviews),47.37780745,8.511905475
1732027467-122,https://www.hotels-zurich.com/search/?sort=Rating&order=DESC&part=1&Name=3,Friendly Hostel Zuerich,"3 Strehlgasse, Zurich, Switzerland","Providing baggage storage for guests, Friendly Hostel Zurich is located merely 6 minutes on foot from Circus Conelli. Featuring Wi-Fi, this hostel is also just a short stroll from…",Good,55 CHF,(2656 reviews),47.371634,8.54130416
1732027467-123,https://www.hotels-zurich.com/search/?sort=Rating&order=DESC&part=1&Name=3,Boutique Hotel Platzhirsch,"Spitalgasse 3, Zurich, Switzerland","Offering a luggage room and a restaurant, the 3-star Hotel Platzhirsch lies in the Old Town district of Zurich, 8 minutes' stroll from Grossmunster and 8 minutes' stroll from…",Excellent,213 CHF,(318 reviews),47.3735166,8.5439446
1732027467-124,https://www.hotels-zurich.com/search/?sort=Rating&order=DESC&part=1&Name=3,City Center Apartment,"33 Zaehringerstrasse, Zurich, Switzerland",City Center Apartment includes a terrace and is located approximately a 10-minute walk from Ulrich Zwingli Monument. Guests can make use of Wi-Fi for both business and leisure…,Good,144 CHF,(814 reviews),47.3757274,8.5444631
1732027467-125,https://www.hotels-zurich.com/search/?sort=Rating&order=DESC&part=1&Name=3,Swiss Star Marc Aurel - Self Check-In,"Badenerstrasse 362, Zurich, Switzerland","Swiss Star Marc Aurel - Self Check-In Apartment offers easy access to such tourist sites as Die Kniende, located about 5 minutes' walk away. A private parking garage is available…",Average,114 CHF,(2029 reviews),47.37888975,8.509330487
1732027467-126,https://www.hotels-zurich.com/search/?sort=Rating&order=DESC&part=1&Name=3,Swiss Star Zurich Sihlfeld - Self Check-In,"Dubsstrasse 30, Zurich, Switzerland","Swiss Star Zurich Sihlfeld - Self Check-In Apartment, set in the Wiedikon district, is within a 600-metre distance of Sihl. The apartment offers a car park for CHF 15…",Average,130 CHF,(787 reviews),47.3675771,8.521691054
1732027467-127,https://www.hotels-zurich.com/search/?sort=Rating&order=DESC&part=1&Name=3,Heart Of Zurich Modern Studio Hg14,"Hirschengraben 3, Zurich, Switzerland","The 25 m² Heart Of Zurich Modern Studio Hg14 Apartment is situated in the Niederdorf district, a 25-minute stroll from Zoo Zurich, which is higly recommended for a family…",Good,209 CHF,(11 reviews),47.3695019,8.547554091
1732027467-128,https://www.hotels-zurich.com/search/?sort=Rating&order=DESC&part=1&Name=3,Garden Studio Apartment Zuerichberg,"Kraftstrasse 30, Zurich, Switzerland",Garden Studio Apartment Zurichberg includes a sun terrace and is situated about 5 minutes' walk from Alte Kirche Fluntern. This apartment features Wi-Fi throughout the property.,Good,211 CHF,(27 reviews),47.3785559,8.55945984
1732027467-129,https://www.hotels-zurich.com/search/?sort=Rating&order=DESC&part=1&Name=3,Heart Of Zurich Modern Studio Hg7,"Hirschengraben 3, Zurich, Switzerland",The 25 m² Heart Of Zurich Modern Studio Hg7 Apartment is located around a 15-minute walk from the historic Urania Observatory and about a 25-minute walk from Museum…,Good,209 CHF,(12 reviews),47.3695019,8.547554091
1732027467-130,https://www.hotels-zurich.com/search/?sort=Rating&order=DESC&part=1&Name=3,Swiss Star District 11 - Self Check-In,"Friesstrasse 33, Zurich, Switzerland","Situated just 13 minutes' walk from Messe Zurich, Swiss Star District 11 - Self Check-In Apartment provides guests with Wi-Fi for either business or leisure. There is Ottikerstrasse at…",Average,132 CHF,(296 reviews),47.4156855,8.54611803
1732027470-131,https://www.hotels-zurich.com/search/?sort=Rating&order=DESC&part=1&Name=2,Park Hyatt Zurich - City Center Luxury,"Beethovenstrasse 21, Zurich, Switzerland","Located near an underground station, the welcoming 5-star Park Hyatt Zurich - City Center Luxury hotel offers its guests a gym, facials, and a health club. Featuring a Chinese garden…",Excellent,517 CHF,(544 reviews),47.366594,8.5361946
1732027470-132,https://www.hotels-zurich.com/search/?sort=Rating&order=DESC&part=1&Name=2,Storchen Zuerich - Lifestyle Boutique Hotel,"Weinplatz 2, Zurich, Switzerland","Providing guests with a bureau de change and a lift, the superior 5-star Storchen Zurich - Lifestyle Boutique Hotel is located near the financial district of Zurich, about a 5…",Excellent,583 CHF,(859 reviews),47.3712661,8.5417938
1732027470-133,https://www.hotels-zurich.com/search/?sort=Rating&order=DESC&part=1&Name=2,Renaissance Zurich Tower Hotel,"Turbinenstrasse 20, Zurich, Switzerland","Situated 0.7 km from Limmat, the 5-star Renaissance Zurich Tower Hotel includes 300 rooms. The hotel also offers a currency exchange and a lift and a private parking garage…",Good,302 CHF,(822 reviews),47.3881885,8.5142697
1732027470-134,https://www.hotels-zurich.com/search/?sort=Rating&order=DESC&part=1&Name=2,25Hours Hotel Langstrasse,"Langstrasse 150, Zurich, Switzerland","Located approximately a 20-minute stroll from Old Botanical Garden, the comfortable 4-star 25Hours Hotel Langstrasse Zurich offers amenities such as a fitness centre and a sundeck. This Zurich…",Excellent,224 CHF,(2634 reviews),47.3804842,8.5285344
1732027470-135,https://www.hotels-zurich.com/search/?sort=Rating&order=DESC&part=1&Name=2,What are the best hotels near Lake Zurich?,"Doeltschiweg 234, Zurich, Switzerland","Offering cars for rent, as well as Wi-Fi in public areas, the 5-star Five Zurich - Luxury City Resort is around 10 minutes' drive from Old Botanical Garden. At…",Excellent,378 CHF,(3572 reviews),47.3631452,8.4956889
1732027470-136,https://www.hotels-zurich.com/search/?sort=Rating&order=DESC&part=1&Name=2,Hotel Felix,"Zaehringerstrasse 25, Zurich, Switzerland","Located merely 500 metres from Rathaus Zurich, the stylish 3-star Hotel Felix Zurich offers various recreational opportunities and a golf course. Nestled in the Old Town district of Zurich…",Excellent,208 CHF,(4184 reviews),47.37521045,8.544449939
1732027470-137,https://www.hotels-zurich.com/search/?sort=Rating&order=DESC&part=1&Name=2,Ibis Budget Zurich City West,"Technoparkstrasse 2, Zurich, Switzerland","The cosy Ibis Budget Zurich City West hotel features a vending machine and a lift and is located nearly a 5-minute ride from the style Liebfrauen Church, one of…",Good,118 CHF,(5936 reviews),47.3889883,8.5161071
1732027470-138,https://www.hotels-zurich.com/search/?sort=Rating&order=DESC&part=1&Name=2,Sorell Hotel Zuerichberg,"Orellistrasse 21, Zurich, Switzerland","Sorell Hotel Zurichberg features a currency exchange and a lift, and lies only 1.4 km from the outdoor Dolder Sports Ice Skating Rink. This hotel also includes private parking.",Excellent,234 CHF,(2545 reviews),47.38243135,8.566894305
